id,video,title,upload_date,channel,views,description,chapters,segments,date_updated
46,YUsqMquFgas,Driving California Coast 8K HDR Dolby Vision - Santa Monica to Santa Barbara (PCH),5072023.0,UCX_uGzVgYJuo_iuYSBqEr4g,67634,"Thanks for watching!  Please like this video & subscribe for more content.  This 2 hour drive starts in Santa Monica California then goes through Pacific Palisades and then up the Pacific Coast Highway PCH toward Malibu.  After Malibu we pass Oxnard and make a quick stop at the Patagonia Headquarters in Ventura then head back on PCH towards Santa Barbara along PCH.   This is a classic California drive you don't want to miss!  Timestamp:  0:00:00 Preview 0:01:00 Santa Monica 0:12:50 PCH - Pacific Palisades 0:20:00 PCH - Malibu 0:43:50 Point Dume - Malibu  0:56:00 Zuma Beach - Malibu 0:58:00 PCH - More Malibu  1:12:00 PCH - Point Mugu 1:21:00 Oxnard  1:43:30 Ventura  1:46:07 Patagonia Headquaters 1:47:00 More Ventura 1:54:30 PCH  2:08:00 PCH Carpinteria  2:13:00 PCH Summerland  2:18:00 PCH Santa Barbara          If you enjoyed this video please like and subscribe and I will create more videos like it.  Thank you for your support.   Best viewed in 8K or 4k HDR TVs.  This video was captured with 3D Binaural Audio ASMR.  Although the audio can be enjoyed with any speakers, headphones provides an immersive experience.  #DrivingTour #Beaches #LosAngeles #Travel #California #beach  #pacificcoasthighway #PCH  #8K #4K #HDR #Driving #lossantos #freeway #pch   [8K HDR] Driving Los Angeles Starting in Westwood and ending in Downtown Los Angeles 8K HDR 60fps with 3D Binaural Audio ASMR mastered in Dolby Vision  Recording Date: May 2023  Stuff I Use HDR Mastering Monitor:  LG 77-inch Class OLED Z2 Series 8K  https://amzn.to/3scOUPi Favorite Drone: Mavic 3 Pro https://amzn.to/3Mm48Iv Waterproof Carry-On: Pelican https://amzn.to/3k5xEHq Gimbal: https://amzn.to/3k3Cg0C Video Storage: https://amzn.to/3CxrAxx Waterproof Camera Bag: https://amzn.to/3CxrAxx Driving Glasses:  Raybans https://amzn.to/3iwuewL Travel Headphones: Apple https://amzn.to/3k74YO4 Studio Headphones: Apple https://amzn.to/3ZmH80Z Software: Adobe CC https://amzn.to/3ZpiP2F   Custom Built Gaming Editing PC CPU: Intel https://amzn.to/3WWVFyQ GPU: NVIDIA https://amzn.to/3XmdmYG Motherboard: https://amzn.to/3ZmJtsR RAM: Kingston https://amzn.to/3WVzpp4 Silent Case: Corsair Silent https://amzn.to/3GQNpeg Gaming Monitor:  https://amzn.to/3D5DTll Gaming Mouse: Logitech G https://amzn.to/3WVzpp4 Gaming Keyboard: Logitech G https://amzn.to/3XBvNZx Gaming Headset: Arctis Nova Pro Wireless https://amzn.to/3X1nMNi  Recommended Products Make Life Easier: Roborock S7MaxV Ultra  https://amzn.to/3QqG5ZX  All Footage in this video is copyright under licensed or created by me. All footage edited And color corrected by me.  Do not reproduce or reupload.   Thank you for watching and your support!  Copyright © 2023 Relaxing Scenes All Rights Reserved.","[{'title': 'Preview', 'timestamp': '0:00:00'}, {'title': 'Santa Monica', 'timestamp': '0:01:00'}, {'title': 'PCH - Pacific Palisades', 'timestamp': '0:12:50'}, {'title': 'PCH - Malibu', 'timestamp': '0:20:00'}, {'title': 'Point Dume - Malibu', 'timestamp': '0:43:50'}, {'title': 'Zuma Beach - Malibu', 'timestamp': '0:56:00'}, {'title': 'PCH - More Malibu', 'timestamp': '0:58:00'}, {'title': 'PCH - Point Mugu', 'timestamp': '1:12:00'}, {'title': 'Oxnard', 'timestamp': '1:21:00'}, {'title': 'Ventura', 'timestamp': '1:43:30'}, {'title': 'Patagonia Headquaters', 'timestamp': '1:46:07'}, {'title': 'More Ventura', 'timestamp': '1:47:00'}, {'title': 'PCH', 'timestamp': '1:54:30'}, {'title': 'PCH Carpinteria', 'timestamp': '2:08:00'}, {'title': 'PCH Summerland', 'timestamp': '2:13:00'}, {'title': 'PCH Santa Barbara', 'timestamp': '2:18:00'}]",4,22112025
47,0iAfu7rJyRQ,"Cayman Islands, Overcast Day, 4K Driving Tour,  From George Town To East End, Then To North Side...",23062024.0,UCF0ksYgQFktZJ1xQKuKVgNQ,2206,"Join us for an unforgettable 4K driving tour through the Cayman Islands, featuring the scenic route from Walkers Road, George Town to East End and North Side District. This video presents a unique perspective on the islands, blending urban elegance with the breathtaking beauty of nature. Experience the iconic architecture and vibrant neighborhoods that make the Cayman Islands a must-visit destination. This driving tour lasted 1:03:29 hour and is intended to be educative. We hope you enjoy this visual journey! Please like, subscribe, and share your feedback in the comments. Thank you for watching! #drivingtour #4kdriving #caymanislands #4KScenery #UrbanNature  This video was captured and edited by me with a Samsung S23 Ultra device on June 2024!  PLAYLISTS: Grand Cayman Driving Tour: https://youtube.com/playlist?list=PLTVyQiSc6Ngya3gx6BQgfmgYXB3VZ_F-4&si=aymVGyGO8Kr92Y6s Grand Cayman Walking Tour: https://youtube.com/playlist?list=PLTVyQiSc6Ngz2DzPjs0q2cKrir9FnMcuO&si=wbuxBb5uUABk4vEz  This channel and its contents are solely owned by exploreforever123. Any unauthorized use of its content, such as reposting or reuploading to a new channel without prior permission, is a criminal offense under the Copyright Law.",[],3,22112025
48,3XCOO6eFlc0,"Morning commute, East End to Road Town.",5062024.0,UCpTdt2a09tB0X8tHf629iyg,23,Drive to work with me. #easttotown #rainydays,[],3,22112025
49,OuMk9dNnwq8,"October 9, 2024 Detroit, Michigan to London, Ontario Trip",23102024.0,UC6cQrbnMQU_a78Hrm3RmYVw,76,"Dashcam video of my trip back to Kingston, Ontario, Canada from Detroit, Michigan. This video shows the first leg of the journey back to Canada where I stopped in London, Ontario for a night before continuing to Toronto, Ontario, and finally arriving back in Kingston that night after stopping to refill gas.",[],9,22112025
50,axeJG8XZl7k,"Gambia’s Most Popular Cities & Highways | New OIC road Serrekunda, Brikama, Soma, Janjanbureh & More",4052025.0,UCdLwwg5FvjEdsIw1_b0C7GA,4298,"Gambia Country Tour 2025 | Latest Drive Through Popular Cities & Highways  Exploring Gambia 2025 | Serrekunda, Brikama, Soma, Janjanbureh & More  Gambia Drive Tour | New OIC Road, Trans Gambia Highway & Historic Towns  Gambia 2025: A Country Changing | Roads, Cities & Landscapes  Gambia’s Most Popular Cities & Highways | Latest Drive Updates  Serrekunda to Janjanbureh | Full Gambia Country Drive 2025  Beautiful Gambia | New Roads, Development & Tourist Attractions 2025  Gambia’s Transforming Landscape | Drive Through Cities & Villages  Historic & Modern Gambia | Countrywide Drive Exploration  Gambia 2025 | Development, Roads & Famous Tourist Spots  Description:  🚗 Explore the latest updates from Gambia in 2025!  🌍 Drive through the most popular cities and highways, witnessing Gambia’s development, historic sites, and changing landscape.  👀 What’s in this video?  ✅ Serrekunda - Gambia’s Largest City ✅ New OIC Road & Infrastructure Development ✅ Brikama & Trans Gambia Highway Drive ✅ Seleti & Soma - Exploring Rural & Urban Gambia ✅ Janjanbureh - A Historic & Tourist Attraction ✅ Real Street Views & Changing Landscapes  📍 Join this exciting country drive across Gambia and witness the transformation of roads, cities, and villages!   #GambiaDrive #ExploreGambia #Gambia2025 #Serrekunda #Brikama #OICRoad #TransGambiaHighway #SomaGambia #Janjanbureh #Seleti #GambiaDevelopment #AfricanRoads #BeautifulGambia #HistoricGambia #ChangingLandscapes",[],6,3062025
51,WZqDgm1DhDM,Driving Las Vegas in 8K HDR Dolby Vision - Zion Utah to Las Vegas Nevada,16012024.0,UCX_uGzVgYJuo_iuYSBqEr4g,1501329,"This video captures our incredible journey from the natural wonders of Zion National Park to the bustling streets of Las Vegas. Experience the diverse landscapes, from rugged mountains and serene deserts to the glittering lights of Las Vegas at Sunset!  If you enjoyed this video please like and subscribe and I will create more videos like it.  Thank you for your support.   Best viewed in 8K or 4k HDR TVs.  This video was captured with 3D Binaural Audio ASMR.  Although the audio can be enjoyed with any speakers, headphones provides an immersive experience.  #LasVegas  #Driving #drivingtour #sunset  #freeway #desert #nevada #zion  #roadtrip #sunsetdrive #study  #relaxing   [8K HDR] Driving Driving to Las Vegas in 8K HDR Dolby Vision - Los Angeles to Las Vegas Nevada 8K 4K HDR 60fps with 3D Binaural Audio ASMR  Recording Date: August 2023  00:00 Preview 01:24 Zion National Park Exit 04:25 Springdale 07:30 Rockville 27:45 La Verkin 35:00 Hurricane  44:52 15 Freeway South to Las Vegas 2:00:00 More 15 Freeway South at Sunset 2:27:00 Las Vegas  2:34:30 Las Vegas Strip    All Footage in this video is copyright under licensed or created by me. All footage edited And color corrected by me.  Do not reproduce or reupload.   Thank you for watching and your support!  Copyright © 2023-2024 Relaxing Scenes All Rights Reserved.","[{'title': 'Preview', 'timestamp': '0:00:00'}, {'title': 'Zion National Park Exit', 'timestamp': '0:01:24'}, {'title': 'Springdale', 'timestamp': '0:04:25'}, {'title': 'Rockville', 'timestamp': '0:07:30'}, {'title': 'La Verkin', 'timestamp': '0:27:45'}, {'title': 'Hurricane', 'timestamp': '0:35:00'}, {'title': '15 Freeway South to Las Vegas', 'timestamp': '0:44:52'}, {'title': 'More 15 Freeway South at Sunset', 'timestamp': '2:00:00'}, {'title': 'Las Vegas', 'timestamp': '2:27:00'}, {'title': 'Las Vegas Strip', 'timestamp': '2:34:30'}]",4,22112025
52,S-S1Vn7wy3A,San Marino by Road - exit from main car park to the Italian Border direction Rimini,18122022.0,UC2fnpxL0qJBoEzS2-C1TlZA,613,In this videro we drive out of the main car park and drive out of San Marino,[],4,22112025
53,HTU0ST4COWk,San Marino by Road - Italian Border to main Car Park,18122022.0,UC2fnpxL0qJBoEzS2-C1TlZA,870,In this video we approach San Marino from Rimini then climb slowly up to the main multi-storey car park - we make at attempt at parking in the cable car car park but it was full.,[],4,22112025
54,qY9uR4XFiwg,Africa travel with a motorcycle | Nigeria | strenuous back-breaking drive from Badagry to Lagos,10032021.0,UCYSGum_OS4lPtlGASbBlelw,62567,"Strenuous back-breaking travel drive from Badagry to Lagos Nigeria  with a bike. An immersive travel in Africa in 4k ultra hd resolution.        Subscribe to the channel here : https://www.youtube.com/channel/UCYSGum_OS4lPtlGASbBlelw  If you are not a subscriber of the primary Ludo Liu channel, you can find it here, (take a look at it and subscribe ):  https://www.youtube.com/c/LudoLiu/videos  SUPPORT ME and donate with paypal : https://www.paypal.com/donate/?hosted_button_id=AW4M4XY6V4BY8  let's connect outside YouTube :  Instagram : https://www.instagram.com/ludo_liu_videos/ Facebook : https://www.facebook.com/LudoLiu.video.production --------------------------------------------------------------------------------------- If you like these videos and would like  to encourage me, please don't hesitate to do it !  Here are two links where you can support me and give me more energy to continue working hard on these videos ! Nothing is too small ....Thank you so much !  https://www.patreon.com/ludoliu --------------------------------------------------------------------------------------- other videos on the channel :  A mega-city Between Ocean and Laguna - Lagos Nigeria https://youtu.be/fVxoUpa2deQ Lagos Nigeria - Sunday bike wander From Ajah -  https://youtu.be/i_ZmWbpDpl4 Christmas drive in the go-slow Of Lagos Nigeria - https://youtu.be/8vFP3wrYtMQ Dive into the belly of Africa's most populated city https://youtu.be/umBS-HEUImM Down-town LAGOS NIGERIA - Discover the African megacity - https://youtu.be/fcq48J2CYQU Crossing the 11.8 km Third Mainland Bridge - Lagos NIGERIA https://youtu.be/DHl7MEomp-k",[],4,28112025
55,DGdOwXUMZkI,Driving Ukraine  Kharkiv - Izum - Slaviansk BZS,13112017.0,UCcIG7JlW94cwvyguY76G5vA,2706,Видео с регистратора. Украина. Харьков - Изюм - Славянск (БЗС),[],3,22112025
56,MB7ZWu9IFCs,Drive to Georgetown From Kingstown | Monday | 5pm Traffic St. Vincent,26042022.0,UCJRNszy02-WMNmna7fJCU2Q,33569,#784VHTV . https://www.instagram.com/harry_d_mixologist/ https://twitter.com/ValandoHarryTV https://www.facebook.com/HarryDMixologist https://www.tiktok.com/@valandoharrytv . #stvincentandthegrenadines #stvincent #Caribbean  . St. Vincent and The Grenadines,[],2,3062025
57,U2hANQA6yLY,5 лет не работал по Украине / Рейс Чернигов - Николаев.,14082020.0,UCXXQcIgz31Mm9lZ5p9q089A,35251,,[],5,22112025
58,fZqP89ro0ro,Napa Valley 4K - California Vineyards - Scenic Drive,4082020.0,UCBcVQr-07MH-p9e2kRTdB3A,209590,"Sunday afternoon drive through Napa Valley near San Francisco California along the popular Silverado Trail.  This area is the premier wine region of the USA and home to over 800 wineries.  The video starts in downtown Napa, continues along the Silverado Trail to Calistoga, and back towards downtown Napa.   Route: https://goo.gl/maps/KMf9qb5sq6TjGbfSA . Napa Valley AVA is an American Viticultural Area located in Napa County in California's Wine Country. Napa Valley is considered one of the premier wine regions in the world. Records of commercial wine production in the region date back to the nineteenth century, but premium wine production dates back only to the 1960s.  The combination of Mediterranean climate, geography and geology of the region are conducive to growing quality wine grapes. John Patchett established the Napa Valley's first commercial vineyard in 1858. In 1861 Charles Krug established another of Napa Valley's first commercial wineries in St. Helena. Viticulture in Napa suffered several setbacks in the late 19th and early 20th centuries, including an outbreak of the vine disease phylloxera, the institution of Prohibition, and the Great Depression. The wine industry in Napa Valley recovered, and helped by the results of the Paris Wine Tasting of 1976, came to be seen as capable of producing the best quality wine – equal to that of Old World wine regions. Napa Valley is now a major enotourism destination.  Napa Valley as a top wine region In 1976, the region got a boost from the Paris Wine Tasting of 1976, which featured a Napa Valley Chardonnay and Cabernet Sauvignon besting several famous French labels in a blind tasting format. The story of the wine competition, termed the ""Judgment of Paris"", was made into a Hollywood movie in 2008, called Bottle Shock. The results of this tasting cemented the region's reputation as a producer of world class wines.  A trend of larger national and international companies like E & J Gallo Winery, Diageo and Constellation Brands buying smaller wineries, vineyards and brands began to gain momentum in the early part of the 21st century. Today Napa Valley features more than 450 wineries that grow grape varieties including Cabernet Sauvignon, Chardonnay, Pinot noir, Merlot, Zinfandel, among others. While winemakers may produce wines from specific AVAs within the valley, many wines are made as a blend from grapes grown on the valley floor and the surrounding hillsides.  https://en.wikipedia.org/wiki/Napa_Valley_AVA  https://en.wikipedia.org/wiki/Wine_Country  https://www.napavalley.com/guides/silverado-trail-wineries/  https://www.visitcalifornia.com/experience/napa-valleys-silverado-trail  https://www.wines.com/blog/the-silverado-trail/",[],3,22112025
59,HLRs2LIjccA,"Guam Driving Tour - Santa Rita, Piti, Asan, Hagåtña, Chalan Pago, Mangilao",13062023.0,UCkfzn70mlFtIXf5Pw31xhkg,3314,"Casual drive northbound along Marine Corps Drive from Santa Rita to Mangilao. Filmed approximately two weeks after typhoon Marwar ravaged the island of Guam, Monday, June12, 2023.",[],3,22112025
60,0g3yUnOchiU,Guam Driving Tour - Hagåtña to Mangilao,29042024.0,UCkfzn70mlFtIXf5Pw31xhkg,1525,Leave the driving to us as we cruise from Santa Rita all the way to Barrigada.,[],5,22112025
61,tK8Tj_XXLHY,Driving Around Tortola BVI: Starting Point East End Police Station To Road Town 2020 | #BVItreasures,21082020.0,UCS76kBngz_gbEgxh8rgp3mw,2374,"Hello my friends I take you on a little longer drive around Tortola British Virgin Islands.  Starting point East End Police Station into Road Town via Ridge (north) road. It takes a little longer to get into town using this route but the change is nice and the views are stunning.   ☕ Buy Me A Virtual Coffee https://gum.co/ogdAQ   👕 Check out my t-shirt store with t-shirts and other items with inspirational quotes http://bit.ly/32ikE2V   🦋 Check out my Amazon Store https://amzn.to/30rIsQY   📲 Check out my photo blog http://www.mjphotorama.com 📲 Instagram http://www.instagram.com/mjphotorama   🦋 Interested in knowing more about the British Virgin Islands?  Check out my blog to learn more.  http://bit.ly/300KW8R   If you enjoyed this video, please, LIKE🖒, COMMENT✏ and SUBSCRIBE to this channel.      📌📌📌📌📌📌 My Gear 📌📌📌📌📌📌 Phone Holder for Car, Hzrfun Cell Phone Holder for Car Dashboard Clip Non-Slip Durable https://amzn.to/3gc6N4Z     📌📌 Connect With Me On Social Media:📌📌 💢Facebook:  https://www.facebook.com/MJphotorama/ 💢Website:  http://www.mjphotorama.com       🎵 Background music: 🎶Source:  YouTube Audio Library During video:  Earth Bound End screen:  Sunday_Plans       #MartinaJ #DrivingAround #Tortola #BritishVirginIslands #drivinginmycar  #bvitreasures",[],2,3062025
62,8XCqMV_hEbY,GDT Mangilao to Agat,9102024.0,UCkfzn70mlFtIXf5Pw31xhkg,413,,[],3,22112025
63,VgIyfbw4NGE,4 K ULTRA HD DRIVE in AFRICA - From Lagos NIGERIA to Ouidah in BENIN  - 4 hours immersive drive,29032022.0,UCYSGum_OS4lPtlGASbBlelw,9162,"Travel in West Africa with my Motorcycle,from NIGERIA to BENIN. Starting from LAGOS city, to drive all the way down to COTONOU in Benin and finally reach Ouidah before the night. This is a ride of about 200 km between two countries in AFRICA.  I hope you will like this 4k ultra hd immersive drive !  Don t forget to give the video a THUMB UP and SUBSCRIBE the channel if it is your first time.  to see the shorter vlog version of that day drive , click here https://youtu.be/4FPHgN8D19s ------------------------------------------------------------------------------------------------------------------------------------- LINK TO SUBSCRIBE HERE : https://www.youtube.com/c/LudoLiu2?sub_confirmation=1 ------------------------------------------------------------------------------------------------------------------------------------- SUPPORT ME and DONATE THE CHANNEL with paypal :  https://www.paypal.com/donate/?hosted_button_id=AW4M4XY6V4BY8 -------------------------------------------------------------------------------------------------------------------------------------  SUPPORT ME ON PATREON https://www.patreon.com/ludoliu  ------------------------------------------------------------------------------------------------------------------------------------- Join this channel to get access to perks: click the link :  https://www.youtube.com/channel/UCYSGum_OS4lPtlGASbBlelw/join  If you are not a subscriber of the primary Ludo Liu channel, you can find it here :  https://www.youtube.com/c/LudoLiu/videos ------------------------------------------------------------------------------------------------------ link up outside Youtube :  Instagram : https://www.instagram.com/ludo_liu_videos/ facebook : https://www.facebook.com/LudoLiu.video.production mail : ludoliu.video@gmail.com",[],3,22112025
64,VBy4f1RVF3k,"Guam Driving Tour - Santa Rita, Agat, Piti, Asan, Hagatña, Tamuning, Upper Tumor, Dededo",19062023.0,UCkfzn70mlFtIXf5Pw31xhkg,1871,"Santa Rita, Agat, Piti, Asan, Hagatña, Tamuning, Upper Tumor, Dededo",[],3,22112025
65,ZluHUNIw8-o,USA Ski Country 4K - Colorado Scenic Drive,19012021.0,UCBcVQr-07MH-p9e2kRTdB3A,538688,"Driving through the Colorado Rocky Mountains from Breckenridge Colorado to Vail Colorado, home to many of the most exclusive and popular ski resorts in America.  Ski resorts in the area include Breckenridge Ski Resort, Keystone Resort, Arapahoe Basin, Loveland Ski Area, Berthoud Pass Ski Area, Winter Park Resort, Beaver Creek Resort, Vail Ski Resort and Copper Mountain. Route:  https://goo.gl/maps/ML4SXQznn7m3JZCWA . Vail, Colorado, is a small town at the base of Vail Mountain, home of the massive Vail Ski Resort. Set within White River National Forest, the town is a gateway for winter sports such as skiing and snowboarding. It’s also a summertime destination for golfing, hiking and cultural festivals. Gore Creek, popular for fly fishing, runs directly through the town center.  https://goo.gl/maps/Yhxer5AiXdawr2xW8  Breckenridge is a Colorado town at the base of the Rocky Mountains’ Tenmile Range. It's known for its ski resort, year-round alpine activities and Gold Rush history. The Victorian core of this former mining town is preserved as the Breckenridge National Historic District, running primarily along Main Street, with colorfully painted buildings from the 1880s and '90s housing shops, galleries and restaurants.  https://goo.gl/maps/qBHHtro36Ermux9A7  The Rocky Mountains, also known as the Rockies, are a major mountain range in western North America. The Rocky Mountains stretch 3,000 mi (4,800 km) in straight-line distance from the northernmost part of British Columbia, in western Canada, to New Mexico in the Southwestern United States.   At the end of the last ice age, humans began inhabiting the mountain range. After explorations of the range by Europeans, natural resources such as mineral and fur drove the initial economic exploitation of the mountains, although the range itself never experienced a dense population.  Of the 100 highest peaks in the Rocky Mountains, 78 (including the 30 highest) are located in Colorado, ten in Wyoming, six in New Mexico, three in Montana, and one in Utah. Public parks and forest lands protect much of the mountain range, and they are popular tourist destinations, especially for hiking, camping, mountaineering, fishing, hunting, mountain biking, skiing, and snowboarding.  https://en.wikipedia.org/wiki/Rocky_Mountains",[],3,22112025
66,LOtYimIdf48,جولة عبر الطريق الساحلي بالرباط,10122023.0,UC3oHtq2yXDQBGxrJdMT8eOA,305,Un tour via la route côtière de Rabat,[],3,22112025
67,aJ3eOJBzwHo,Driving Thru The Country Of Puerto Rico Province | 4K Street View Tour,2092023.0,UCePc3oh2NSq-Lp18ZLUpXcQ,8885,Check out this country tour over Puerto Rico... I'll point out locations here in the description so you can jump between if you like to 0:00 Isabela City 15:47 Aguadilla 34:05 Rafael Hernandez International Airport 48:42 Old San Juan 55:22 San Juan Suburbs,"[{'title': 'Isabela City', 'timestamp': '0:00:00'}, {'title': 'Aguadilla', 'timestamp': '0:15:47'}, {'title': 'Rafael Hernandez International Airport', 'timestamp': '0:34:05'}, {'title': 'Old San Juan', 'timestamp': '0:48:42'}, {'title': 'San Juan Suburbs', 'timestamp': '0:55:22'}]",4,22112025
68,oY4tEwjPM1Y,Musanze to Kigali drive full drive,19112024.0,UCQ1nxdMNriWDgH0BAVkM-kw,135,Enjoy this video of driving from Musanze to Kigali,[],3,22112025
69,F9lmr2VsEcQ,Andorra Drive 4K POV (including Andorra la Vella),22022025.0,UCeaLkQCZ2LLKwenAC1Eem6A,19959,"POV Drive: Exploring Andorra – A Scenic Journey Through the Pyrenees  Join me on an unforgettable drive through Andorra, a tiny yet breathtaking country nestled in the Pyrenees mountains. This unique journey showcases stunning alpine landscapes, winding mountain roads, and charming villages, offering a spectacular glimpse into one of Europe’s most picturesque microstates.  As we navigate Andorra’s scenic routes, you'll experience dramatic mountain views, deep valleys, and sharp hairpin turns, all while passing through historic towns and duty-free shopping hotspots. Andorra’s roads are a dream for any driving enthusiast, blending natural beauty with well-maintained highways that carve through the rugged terrain.  🎥 Highlights include:  Scenic Mountain Passes – Breathtaking views of snow-capped peaks and lush valleys. Andorra’s Unique Charm – A blend of Catalan culture, modernity, and historic mountain villages. Twisting Alpine Roads – Enjoy the thrill of winding roads through this hidden European gem.  🌟 Features:  POV driving experience with immersive visuals and natural road sounds. Uninterrupted footage showcasing the stunning landscapes of Andorra. Perfect for travel inspiration, road trip planning, or a relaxing scenic drive.  🌍 Route Details:  Starting Point: https://maps.app.goo.gl/7farijB5Wq7QmqNu5 Ending Point: https://maps.app.goo.gl/eqDKcEsq1ZKQNUPf7 Duration: 42 min  🚗 Buckle up and enjoy the ride through one of Europe’s most incredible mountain escapes! Don’t forget to like, comment, and subscribe for more scenic driving adventures.",[],5,3062025
70,yYr2-zIG5w4,RUSTAVI | GACHIANI | LILO - Video Tourism 4K Virtual Tour,22022021.0,UCCE-xpYirsKwSuhoJmCWJ0g,2068,📽Camera: Osmo Pocket 🎬Video editor: Premier pro,[],3,22112025
