id,video,title,upload_date,channel,views,description,chapters,segments,date_updated
107,qz7w3i--nlQ,5 Hour FULL-length POV drive from Christchurch to Waikawa on New Zealand State Highway 1,10102024,UCcwGwvM5iPB9IvtTnMTVcEg,4349,"Enjoy this FULL-length POV (Point Of View) drive from Christchurch to Waikawa on New Zealand's State Highway 1 🛑Please Subscribe➤http://bit.ly/-STV  Sit Back, Relax, and Enjoy watching this FULL-length scenic road trip video in 4K quality. This Relaxing Video is best watched on a 4K big-screen TV with your legs stretched out on a big comfy couch. Optional, mute the video sound and play your favorite music along with the video.  ***** Route Info ***** ◎ Drive Date: January 2024 ◎ Start: City of Christchurch, New Zealand ◎ End: Town of Waikawa, New Zealand ◎ Drive Distance from Christchurch to Waikawa: 342 km / 212 mi ◎ Drive Time from Christchurch to Waikawa: 5 Hour 9 Minutes ◎ Route: https://maps.app.goo.gl/6GPJ79nPNaBMPjieA  ***** Places and Interesting points along the route ***** • 0:00 - City of Christchurch, New Zealand • 18:26 - New Zealand State Highway 74 (Motorway) • 23:11 - New Zealand State Highway 1 (Motorway) • 29:21 - New Zealand State Highway 1 • 31:34 - Town of Woodend, New Zealand • 35:59 - Town of Waikuku, New Zealand • 51:52 - Town of Amberley, New Zealand • 1:38:35 - Town of Domett, New Zealand • 1:43:31 - Town of Cheviot, New Zealand • 1:51:37 - Hamlet of Spotswood, New Zealand • 1:54:03 - Town of Parnassus, New Zealand • 2:36:28 - Town of Peketā, New Zealand • 2:37:10 - Kaikoura Airport • 2:43:35 - Town of Kaikōura, New Zealand • 3:33:58 - Village of Kekerengu, New Zealand • 3:34:52 - Kekerengu Beach • 3:54:18 - Town of Ward, New Zealand • 4:10:18 - Town of Seddon, New Zealand • 4:30:47 - Town of Blenheim, New Zealand • 4:37:58 - Town of Spring Creek, New Zealand • 4:40:52 - Town of Tuamarina, New Zealand • 4:51:04 - Picton Airport • 4:57:54 - Town of Picton, New Zealand • 5:04:59 - Town of Waikawa, New Zealand • 5:07:44 - Waikawa Marina, New Zealand  ▶️Website: https://sigistravelvideos.com ▶️My Trips on Google My Maps: https://bit.ly/SigisTrips","[{'title': 'City of Christchurch, New Zealand', 'timestamp': '0:00:00'}, {'title': 'New Zealand State Highway 74 (Motorway)', 'timestamp': '0:18:26'}, {'title': 'New Zealand State Highway 1 (Motorway)', 'timestamp': '0:23:11'}, {'title': 'New Zealand State Highway 1', 'timestamp': '0:29:21'}, {'title': 'Town of Woodend, New Zealand', 'timestamp': '0:31:34'}, {'title': 'Town of Waikuku, New Zealand', 'timestamp': '0:35:59'}, {'title': 'Town of Amberley, New Zealand', 'timestamp': '0:51:52'}, {'title': 'Town of Domett, New Zealand', 'timestamp': '1:38:35'}, {'title': 'Town of Cheviot, New Zealand', 'timestamp': '1:43:31'}, {'title': 'Hamlet of Spotswood, New Zealand', 'timestamp': '1:51:37'}, {'title': 'Town of Parnassus, New Zealand', 'timestamp': '1:54:03'}, {'title': 'Town of Peketā, New Zealand', 'timestamp': '2:36:28'}, {'title': 'Kaikoura Airport', 'timestamp': '2:37:10'}, {'title': 'Town of Kaikōura, New Zealand', 'timestamp': '2:43:35'}, {'title': 'Village of Kekerengu, New Zealand', 'timestamp': '3:33:58'}, {'title': 'Kekerengu Beach', 'timestamp': '3:34:52'}, {'title': 'Town of Ward, New Zealand', 'timestamp': '3:54:18'}, {'title': 'Town of Seddon, New Zealand', 'timestamp': '4:10:18'}, {'title': 'Town of Blenheim, New Zealand', 'timestamp': '4:30:47'}, {'title': 'Town of Spring Creek, New Zealand', 'timestamp': '4:37:58'}, {'title': 'Town of Tuamarina, New Zealand', 'timestamp': '4:40:52'}, {'title': 'Picton Airport', 'timestamp': '4:51:04'}, {'title': 'Town of Picton, New Zealand', 'timestamp': '4:57:54'}, {'title': 'Town of Waikawa, New Zealand', 'timestamp': '5:04:59'}, {'title': 'Waikawa Marina, New Zealand', 'timestamp': '5:07:44'}]",14,24042026
108,dVsQPJXgb4Q,"Driving from Naarden to Nieuwkoop, Netherlands🇳🇱",20062022,UCcwGwvM5iPB9IvtTnMTVcEg,13483,"Today you will be in the driver's seat while driving from Naarden to Nieuwkoop in the Netherlands, aka Holland 🛑Please Subscribe➤http://bit.ly/-STV  Sit Back, Relax and Enjoy watching this FULL-length scenic road trip video in 4K quality. This Relaxing Video is best watched on a 4K big-screen TV with your legs stretched out on a big comfy couch. Optional, mute the video sound and play your favorite music along with the video.  ---------- Route Info ---------- ◎ Drive Date: May 2, 2022 ◎ Start: Naarden, Netherlands ◎ End: Nieuwkoop, Netherlands ◎ Drive Distance: 40 km / 25 mi ◎ Drive Time: 1 Hour 18 Minutes ◎ Route: https://goo.gl/maps/xrnUu2shHT6jkDPN6  ---------- Places and Interesting points along the route ---------- • 0:00 - Naarden, Netherlands • 11:53 - Bussum, Netherlands • 13:46 - Hilversumse Meent, Netherlands • 16:44 - 's-Graveland, Netherlands • 19:11 - Ankeveen, Netherlands • 29:25 - Kortenhoef, Netherlands • 32:37 - Oud-Loosdrecht, Netherlands • 40:02 - Loenen aan de Vecht, Netherlands • 42:38 - Nieuwersluis, Netherlands • 46:03 - Breukelen, Netherlands • 1:04:46 - Woerdense Verlaat, Netherlands • 1:08:01 - Noorden, Netherlands • 1:16:02 - Nieuwkoop, Netherlands  ◉Website: http://SigisTravelVideos.com  ***Other YouTube Channels*** 🔹VMC Aviation Videos: https://bit.ly/3dBD5a7 🔹NO BULL 4K Road Trips: https://bit.ly/3a3VNGK​​ 🔹4K Scenic Relaxation: https://bit.ly/3tJXAZC​​ 🔹iLoveMyCats: https://bit.ly/3711vY1​  #Naarden #Nieuwkoop #Netherlands #Holland #RoadTrip #Screensaver #DriversView #TravelVideo #CarDrive #Travel #DashCam #ScenicDrive #RoadTravel","[{'title': 'Naarden, Netherlands', 'timestamp': '0:00:00'}, {'title': 'Bussum, Netherlands', 'timestamp': '0:11:53'}, {'title': 'Hilversumse Meent, Netherlands', 'timestamp': '0:13:46'}, {'title': ""'s-Graveland, Netherlands"", 'timestamp': '0:16:44'}, {'title': 'Ankeveen, Netherlands', 'timestamp': '0:19:11'}, {'title': 'Kortenhoef, Netherlands', 'timestamp': '0:29:25'}, {'title': 'Oud-Loosdrecht, Netherlands', 'timestamp': '0:32:37'}, {'title': 'Loenen aan de Vecht, Netherlands', 'timestamp': '0:40:02'}, {'title': 'Nieuwersluis, Netherlands', 'timestamp': '0:42:38'}, {'title': 'Breukelen, Netherlands', 'timestamp': '0:46:03'}, {'title': 'Woerdense Verlaat, Netherlands', 'timestamp': '1:04:46'}, {'title': 'Noorden, Netherlands', 'timestamp': '1:08:01'}, {'title': 'Nieuwkoop, Netherlands', 'timestamp': '1:16:02'}]",13,24042026
109,QApo1-yPUzc,Zaboravljeni putovi BiH 🚗 | Starim putem Zenica → Sarajevo – Scenic Drive,15022025,UCI2ICOR8o5duyoq-UMJaVDw,561,"Krenuli smo starim putem od Zenice do Sarajeva, prolazeći kroz Kakanj, Visoko, Ilijaš i brojna druga naselja. Ova regionalna cesta pruža jedinstven ugođaj vožnje kroz prelijepu Bosnu i Hercegovinu, uz zanimljive pejzaže i historijske lokalitete. Kako izgleda ova ruta danas? Pogledajte u videu!  📌 Ruta: Zenica – Kakanj – Visoko – Ilijaš – Sarajevo 📌 Cesta: Stari put (regionalna cesta) 📌 Dužina rute: ~70 km 📌 Vrijeme putovanja: ~1h 30min  🛑 Ne zaboravite lajkati, komentarisati i pretplatiti se na kanal!  #Zenica #Sarajevo #Kakanj #Visoko #Ilijaš #Vožnja #Bosna #CesteBiH #StariPut #Putovanje  Na našem kanalu možete: ✅ Istražiti skrivene dragulje naše zemlje ✅ Naučiti o sigurnosti u saobraćaju i korisnim aplikacijama za vozače ✅ Gledati arhivske snimke i priče s puteva ✅ Uživati u intervjuima s vozačima i stručnjacima  📌 Ne propustite i našu rubriku ""Grehota bi bila da se baci"" – svaki dan u 9h donosimo priče koje će vas inspirisati!  🎥 Pretplatite se na kanal i postanite dio naše zajednice ljubitelja Bosne i Hercegovine! Kliknite zvonce za obavijesti o novim videima. 🔔  🔗 Pogledajte više i pridružite nam se na ovom putovanju. Vaša podrška čini razliku! ❤️  Pretplatite se sada i zavirite u svaki kutak Bosne i Hercegovine kroz naš objektiv! Vaša priča počinje ovdje. 👇 #BHroadstories #BosnaiHercegovina #Putovanja‪  Pratite nas na društvenim mrežama: Facebook stranica: https://www.facebook.com/people/BH-Road-Stories/100063943599462/ Facebook grupa: https://www.facebook.com/groups/251788405985251   @BHRoadStoriesBH    ╔═╦╗╔╦╗╔═╦═╦╦╦╦╗╔═╗ ║╚╣║║║╚╣╚╣╔╣╔╣║╚╣═╣ ╠╗║╚╝║║╠╗║╚╣║║║║║═╣ ╚═╩══╩═╩═╩═╩╝╚╩═╩═╝",[],13,24042026
110,ur4gHPEx0nY,"Driving - 05-04-2024 - 🇳🇱 - Running Errands, Visiting People",02062024,UCUUPDaFc0ENkfBIJhCfGmdg,542,"I needed to run some long-distance errands, and I thought I might as well visit some friends and family on the way  0:00 - Eindhoven, Center (Mauritsstraat & Vonderweg) 2:29 - Eindhoven, Center (Fellenoord) 5:23 - Eindhoven, Tongelre (Prof. Dr. Dorgelolaan) 8:19 - N270 - Eindhoven, Tongelre (Eisenhowerlaan) 10:05 - A270 / N270 - Between Eindhoven and Helmond 14:11 - N270 - Helmond, West & 't Hout (Europaweg) 18:12 - N270 - Helmond, Binnenstad (Kasteel-Traverse) 19:55 - N270 - Helmond, Oost & Rijpelberg (Deurnseweg) 24:20 - N270 - Between Helmond and Deurne 28:36 - N270 - Deurne (Helmondsingel) 31:37 - N270 - Between Deurne and Venray 44:09 - Leunen (Zuivelweg & Leunseweg) 45:29 - Venray, Brukske (Leunseweg) 46:26 - Venray, Centrum-Oost (Zuidsingel & Oostsingel) 49:22 - Venray, Landweert (Nieuwe Maasheseweg) 51:15 - Venray, Landweert (Keizersveld) 55:26 - Venray, Landweert (Nieuwe Maasheseweg) 56:23 - Venray, Centrum-Oost (Oostsingel & Stationsweg) 58:12 - Venray, Centrum (Julianasingel & Paterslaan) 1:00:29 - Venray, Centrum-West (Langstraat) 1:02:46 - Between Venray and Heide (Heidseweg) 1:04:12 - Heide (Heidseweg & Heidseschoolweg) 1:04:51 - Between Heide and Deurne (Heidseschoolweg) 1:06:11 - N270 - Between Heide and Deurne 1:15:30 - N270 - Deurne (Helmondsingel) 1:19:11 - Deurne (Binderendreef & Vlierdensedreef) 1:23:23 - Between Deurne and Asten (Vlierdensedreef & Deurneseweg) 1:29:25 - A67 - Between Asten and Eindhoven 1:39:42 - A67 / A2 - Randweg Eindhoven 1:45:16 - A67 - Between Eindhoven and Hapert 1:52:51 - N284 - Between Hapert and Bladel 2:00:25 - Bladel (Europalaan & Helleneind) 2:03:28 - Between Bladel and Hulsel (Hulselseweg) 2:05:59 - Hulsel (Willibrordlaan & Vooreind) 2:08:50 - Between Hulsel and Lage Mierde (Vooreind & Vloeieind) 2:10:35 - Lage Mierde (Vloeieind & Draaiboom) 2:12:11 - Lage Mierde (Dorpsplein) 2:13:17 - Lage Mierde (Draaiboom & Vloeieind) 2:15:33 - N269 - Between Lage Mierde and Netersel 2:16:51 - Between Lage Mierde and Netersel (Neterselsedijk) 2:20:30 - Netersel (De Lei & Fons van der Heijdenstraat) 2:22:38 - Between Netersel and Westelbeers (Fons van der Heijdenstr.) 2:26:31 - Westelbeers (Broekeindsedijk) 2:27:11 - Between Westelbeers & Middelbeers (Voldijnseweg) 2:28:46 - Middelbeers (Westelbeersedijk) 2:30:54 - Middelbeers (Willibrordstraat & Doornboomstraat) 2:32:25 - N395 - Middelbeers (Hertog Janstraat) 2:33:37 - N395 - Oostelbeers (Andreasstraat) 2:35:04 - N395 - Between Oostelbeers & Oirschot 2:39:21 - Oirschot (Kempenweg & Bestseweg) 2:43:28 - Between Oirschot and Best (Bestseweg) 2:44:42 - Best, Heivelden & Heuveleind (Oirschotseweg & Ringweg) 2:48:12 - Best, Naastenbest & 't Zand (Willem de Zwijgerweg) 2:51:10 - Best, 't Zand (Zandstraat & I.B.C.-weg) 2:55:34 - Best (Eindhovenseweg-Zuid) 2:56:16 - Between Best and Eindhoven (Eindhovensweg-Z. & Boschdijk) 2:58:15 - Eindhoven, Woensel-Noord (Boschdijk) 3:02:24 - Eindhoven, Woensel-Zuid (Lieven de Keylaan & Churchillaan) 3:06:06 - Eindhoven, Woensel-Zuid (Veldmaarschalk Montgomerylaan) 3:07:43 - Eindhoven, Woensel-Zuid (Generalenbuurt) 3:08:49 - Eindhoven, Woensel-Zuid (John F. Kennedylaan) 3:09:38 - Eindhoven, Woensel-Zuid (Ring Road) 3:13:21 - Eindhoven, Strijp (Ring Road) 3:16:21 - Eindhoven, Gestel (Ring Road) 3:18:46 - Eindhoven, Gestel (Hoogstraat)","[{'title': 'Eindhoven, Center (Mauritsstraat & Vonderweg)', 'timestamp': '0:00:00'}, {'title': 'Eindhoven, Center (Fellenoord)', 'timestamp': '0:02:29'}, {'title': 'Eindhoven, Tongelre (Prof. Dr. Dorgelolaan)', 'timestamp': '0:05:23'}, {'title': 'N270 - Eindhoven, Tongelre (Eisenhowerlaan)', 'timestamp': '0:08:19'}, {'title': 'A270 / N270 - Between Eindhoven and Helmond', 'timestamp': '0:10:05'}, {'title': ""N270 - Helmond, West & 't Hout (Europaweg)"", 'timestamp': '0:14:11'}, {'title': 'N270 - Helmond, Binnenstad (Kasteel-Traverse)', 'timestamp': '0:18:12'}, {'title': 'N270 - Helmond, Oost & Rijpelberg (Deurnseweg)', 'timestamp': '0:19:55'}, {'title': 'N270 - Between Helmond and Deurne', 'timestamp': '0:24:20'}, {'title': 'N270 - Deurne (Helmondsingel)', 'timestamp': '0:28:36'}, {'title': 'N270 - Between Deurne and Venray', 'timestamp': '0:31:37'}, {'title': 'Leunen (Zuivelweg & Leunseweg)', 'timestamp': '0:44:09'}, {'title': 'Venray, Brukske (Leunseweg)', 'timestamp': '0:45:29'}, {'title': 'Venray, Centrum-Oost (Zuidsingel & Oostsingel)', 'timestamp': '0:46:26'}, {'title': 'Venray, Landweert (Nieuwe Maasheseweg)', 'timestamp': '0:49:22'}, {'title': 'Venray, Landweert (Keizersveld)', 'timestamp': '0:51:15'}, {'title': 'Venray, Landweert (Nieuwe Maasheseweg)', 'timestamp': '0:55:26'}, {'title': 'Venray, Centrum-Oost (Oostsingel & Stationsweg)', 'timestamp': '0:56:23'}, {'title': 'Venray, Centrum (Julianasingel & Paterslaan)', 'timestamp': '0:58:12'}, {'title': 'Venray, Centrum-West (Langstraat)', 'timestamp': '1:00:29'}, {'title': 'Between Venray and Heide (Heidseweg)', 'timestamp': '1:02:46'}, {'title': 'Heide (Heidseweg & Heidseschoolweg)', 'timestamp': '1:04:12'}, {'title': 'Between Heide and Deurne (Heidseschoolweg)', 'timestamp': '1:04:51'}, {'title': 'N270 - Between Heide and Deurne', 'timestamp': '1:06:11'}, {'title': 'N270 - Deurne (Helmondsingel)', 'timestamp': '1:15:30'}, {'title': 'Deurne (Binderendreef & Vlierdensedreef)', 'timestamp': '1:19:11'}, {'title': 'Between Deurne and Asten (Vlierdensedreef & Deurneseweg)', 'timestamp': '1:23:23'}, {'title': 'A67 - Between Asten and Eindhoven', 'timestamp': '1:29:25'}, {'title': 'A67 / A2 - Randweg Eindhoven', 'timestamp': '1:39:42'}, {'title': 'A67 - Between Eindhoven and Hapert', 'timestamp': '1:45:16'}, {'title': 'N284 - Between Hapert and Bladel', 'timestamp': '1:52:51'}, {'title': 'Bladel (Europalaan & Helleneind)', 'timestamp': '2:00:25'}, {'title': 'Between Bladel and Hulsel (Hulselseweg)', 'timestamp': '2:03:28'}, {'title': 'Hulsel (Willibrordlaan & Vooreind)', 'timestamp': '2:05:59'}, {'title': 'Between Hulsel and Lage Mierde (Vooreind & Vloeieind)', 'timestamp': '2:08:50'}, {'title': 'Lage Mierde (Vloeieind & Draaiboom)', 'timestamp': '2:10:35'}, {'title': 'Lage Mierde (Dorpsplein)', 'timestamp': '2:12:11'}, {'title': 'Lage Mierde (Draaiboom & Vloeieind)', 'timestamp': '2:13:17'}, {'title': 'N269 - Between Lage Mierde and Netersel', 'timestamp': '2:15:33'}, {'title': 'Between Lage Mierde and Netersel (Neterselsedijk)', 'timestamp': '2:16:51'}, {'title': 'Netersel (De Lei & Fons van der Heijdenstraat)', 'timestamp': '2:20:30'}, {'title': 'Between Netersel and Westelbeers (Fons van der Heijdenstr.)', 'timestamp': '2:22:38'}, {'title': 'Westelbeers (Broekeindsedijk)', 'timestamp': '2:26:31'}, {'title': 'Between Westelbeers & Middelbeers (Voldijnseweg)', 'timestamp': '2:27:11'}, {'title': 'Middelbeers (Westelbeersedijk)', 'timestamp': '2:28:46'}, {'title': 'Middelbeers (Willibrordstraat & Doornboomstraat)', 'timestamp': '2:30:54'}, {'title': 'N395 - Middelbeers (Hertog Janstraat)', 'timestamp': '2:32:25'}, {'title': 'N395 - Oostelbeers (Andreasstraat)', 'timestamp': '2:33:37'}, {'title': 'N395 - Between Oostelbeers & Oirschot', 'timestamp': '2:35:04'}, {'title': 'Oirschot (Kempenweg & Bestseweg)', 'timestamp': '2:39:21'}, {'title': 'Between Oirschot and Best (Bestseweg)', 'timestamp': '2:43:28'}, {'title': 'Best, Heivelden & Heuveleind (Oirschotseweg & Ringweg)', 'timestamp': '2:44:42'}, {'title': ""Best, Naastenbest & 't Zand (Willem de Zwijgerweg)"", 'timestamp': '2:48:12'}, {'title': ""Best, 't Zand (Zandstraat & I.B.C.-weg)"", 'timestamp': '2:51:10'}, {'title': 'Best (Eindhovenseweg-Zuid)', 'timestamp': '2:55:34'}, {'title': 'Between Best and Eindhoven (Eindhovensweg-Z. & Boschdijk)', 'timestamp': '2:56:16'}, {'title': 'Eindhoven, Woensel-Noord (Boschdijk)', 'timestamp': '2:58:15'}, {'title': 'Eindhoven, Woensel-Zuid (Lieven de Keylaan & Churchillaan)', 'timestamp': '3:02:24'}, {'title': 'Eindhoven, Woensel-Zuid (Veldmaarschalk Montgomerylaan)', 'timestamp': '3:06:06'}, {'title': 'Eindhoven, Woensel-Zuid (Generalenbuurt)', 'timestamp': '3:07:43'}, {'title': 'Eindhoven, Woensel-Zuid (John F. Kennedylaan)', 'timestamp': '3:08:49'}, {'title': 'Eindhoven, Woensel-Zuid (Ring Road)', 'timestamp': '3:09:38'}, {'title': 'Eindhoven, Strijp (Ring Road)', 'timestamp': '3:13:21'}, {'title': 'Eindhoven, Gestel (Ring Road)', 'timestamp': '3:16:21'}, {'title': 'Eindhoven, Gestel (Hoogstraat)', 'timestamp': '3:18:46'}]",13,24042026
111,k-jmKra6GBc,Driving in Hungary from Zalaegerszeg to Slovenia then to Novakovec Croatia in November 2023.,18012024,UCKPKkECp7Ad_GjQ8MFm1nXg,11127,"Driving in Hungary from Zalaegerszeg to Slovenia and then to Novakovec Croatia in November 2023, on a country road between cities and towns. Thank you very much everyone for watching.   Route  https://maps.app.goo.gl/P7H6uomNMBSj45Hz5?g_st=ic  القيادة في المجر من زالاجيرسيج إلى سلوفينيا ثم إلى نوفاكوفيتس كرواتيا في نوفمبر 2023، على طريق ريفي بين المدن والبلدات. شكرا جزيلا للجميع على المشاهدة.  Conduire en Hongrie de Zalaegerszeg à la Slovénie puis à Novakovec Croatie en novembre 2023, sur une route de campagne entre villes et villages. Merci beaucoup à tous d'avoir regardé.  Fahrt in Ungarn von Zalaegerszeg nach Slowenien und dann nach Novakovec in Kroatien im November 2023 auf einer Landstraße zwischen Städten und Gemeinden. Vielen Dank an alle fürs Zuschauen.  Conducerea în Ungaria de la Zalaegerszeg în Slovenia și apoi la Novakovec Croația în noiembrie 2023, pe un drum de țară între orașe și orașe. Mulțumesc frumos tuturor pentru vizionare.  Поездка по Венгрии из Залаэгерсега в Словению, а затем в Новаковец, Хорватия, ноябрь 2023 года, по проселочной дороге между городами. Большое спасибо всем за просмотр.  Вожња у Мађарској од Залаегершега до Словеније, а затим до Новаковца у Хрватској у новембру 2023. године, сеоским путем између градова и насеља. Хвала вам пуно свима на гледању.  Jazda v Maďarsku zo Zalaegerszegu do Slovinska a potom do Novakovca v Chorvátsku v novembri 2023, po vidieckej ceste medzi mestami a obcami. Ďakujem veľmi pekne všetkým za sledovanie.  Vožnja na Madžarskem iz Zalaegerszega v Slovenijo in nato v Novakovec na Hrvaškem novembra 2023 po podeželski cesti med mesti in kraji. Najlepša hvala vsem za ogled.  Conduciendo por Hungría desde Zalaegerszeg a Eslovenia y luego a Novakovec Croacia en noviembre de 2023, por una carretera rural entre ciudades y pueblos. Muchas gracias a todos por mirar.  ขับรถในฮังการีจาก Zalaegerszeg ไปยังสโลวีเนีย จากนั้นไปยัง Novakovec Croatia ในเดือนพฤศจิกายน 2023 บนถนนในชนบทระหว่างเมืองต่างๆ ขอบคุณทุกคนที่รับชมมากๆครับ  Şehirler ve kasabalar arasındaki bir köy yolunda, Kasım 2023'te Macaristan'da Zalaegerszeg'den Slovenya'ya ve ardından Novakovec Hırvatistan'a yolculuk. İzlediğiniz için herkese çok teşekkür ederim.  Vožnja u Mađarskoj od Zalaegerszega do Slovenije, a zatim do Novakovca u Hrvatskoj u studenom 2023., seoskom cestom između gradova i mjesta. Puno hvala svima na gledanju.  Jízda v Maďarsku ze Zalaegerszegu do Slovinska a poté do Novakovec Chorvatsko v listopadu 2023, po venkovské silnici mezi městy a městy. Všem moc děkuji za sledování.  नवंबर 2023 में शहरों और कस्बों के बीच एक ग्रामीण सड़क पर हंगरी में ज़ैलेगर्सजेग से स्लोवेनिया और फिर नोवाकोवेक क्रोएशिया तक ड्राइविंग। देखने के लिए आप सभी का बहुत-बहुत धन्यवाद।  Rijden in Hongarije van Zalaegerszeg naar Slovenië en vervolgens naar Novakovec Kroatië in november 2023, over een landweg tussen steden en dorpen. Iedereen hartelijk bedankt voor het kijken.  Guidando in Ungheria da Zalaegerszeg alla Slovenia e poi a Novakovec Croazia nel novembre 2023, su una strada di campagna tra città e paesi. Grazie mille a tutti per la visione.  Οδηγώντας στην Ουγγαρία από το Zalaegerszeg στη Σλοβενία ​​και στη συνέχεια στο Novakovec της Κροατίας τον Νοέμβριο του 2023, σε έναν επαρχιακό δρόμο μεταξύ πόλεων και κωμοπόλεων. Σας ευχαριστώ πολύ όλους για την παρακολούθηση.  Autózás Magyarországon Zalaegerszegről Szlovéniába, majd Novakovec Horvátországba 2023 novemberében, városok közötti országúton. Mindenkinek nagyon köszönöm, hogy megnézte.  2023年11月にハンガリーのザラエゲルセクからスロベニア、そしてクロアチアのノヴァコヴェツまで、都市と町の間の田舎道をドライブ。ご覧いただきました皆様、誠にありがとうございました。  Jazda na Węgrzech z Zalaegerszeg do Słowenii, a następnie do Novakovca w Chorwacji w listopadzie 2023 r., po wiejskiej drodze między miastami. Dziękuję bardzo wszystkim za obejrzenie.  Dirigindo na Hungria de Zalaegerszeg para a Eslovênia e depois para Novakovec Croácia em novembro de 2023, em uma estrada secundária entre cidades e vilas. Muito obrigado a todos por assistirem.  Mengemudi di Hongaria dari Zalaegerszeg ke Slovenia dan kemudian ke Novakovec Kroasia pada November 2023, di jalan pedesaan antara kota besar dan kecil. Terima kasih banyak semuanya telah menonton.  헝가리에서 Zalaegerszeg에서 슬로베니아까지 그리고 2023년 11월 크로아티아 Novakovec까지 도시와 마을 사이의 시골길을 따라 운전합니다. 시청해 주신 모든 분들께 진심으로 감사드립니다.  Lái xe ở Hungary từ Zalaegerszeg đến Slovenia rồi đến Novakovec Croatia vào tháng 11 năm 2023, trên con đường quê giữa các thành phố và thị trấn. Cảm ơn mọi người rất nhiều vì đã xem.  Їду в Угорщині із Залаегерсега до Словенії, а потім до Новаковця в Хорватії в листопаді 2023 року по сільській дорозі між містами та селищами. Дуже дякую всім за перегляд.  Pagmamaneho sa Hungary mula Zalaegerszeg hanggang Slovenia at pagkatapos ay sa Novakovec Croatia noong Nobyembre 2023, sa isang country road sa pagitan ng mga lungsod at bayan. Maraming salamat sa lahat ng tao sa panonood.  #gopro #4k #driving #roadtrip#solo_traveler_7o #enjoy #travel #funny #world #europe #croatia #slovenia #hungary",[],12,24042026
