id,video,title,upload_date,channel,views,description,chapters,segments,date_updated
122,H8UUOOrYZNo,Driving in Latvia. A trip from Valka to Riga. 4K,26082021,UCvLzZbl8OQVa7VDedEtkX9A,3190,Valka – Strenči – Valmiera – Stalbe – Plācis – Straupe – Ragana – Murjāņi – Riga – Vanšu tilts (Shroud Bridge)   0:00 Valka 3:45 Strenci 7:36 Valmiera 10:43 Stalbe 11:50 Placis 13:07 Straupe 15:12 Ragana 16:08 Murjani 20:03 Riga - Pskov road 23:18 Riga 23:37 Brīvības gatve 36:10 Gaisa tilts 37:43 Brīvības iela 43:12 Brīvības bulvāris 43:36 Kalpaka bulvāris 45:17 Krišjāņa Valdemāra iela 46:58 Vanšu tilts  #latvia #riga #virtualdrive #virtual drive   If you enjoyed the video support our channel for free 💖: 🔔 Subscribe to our channel  👍 Like a video  💬 Leave a comment 📺 Watch the video for the entire duration Thanks!,"[{'title': 'Valka', 'timestamp': '0:00:00'}, {'title': 'Strenci', 'timestamp': '0:03:45'}, {'title': 'Valmiera', 'timestamp': '0:07:36'}, {'title': 'Stalbe', 'timestamp': '0:10:43'}, {'title': 'Placis', 'timestamp': '0:11:50'}, {'title': 'Straupe', 'timestamp': '0:13:07'}, {'title': 'Ragana', 'timestamp': '0:15:12'}, {'title': 'Murjani', 'timestamp': '0:16:08'}, {'title': 'Riga - Pskov road', 'timestamp': '0:20:03'}, {'title': 'Riga', 'timestamp': '0:23:18'}, {'title': 'Brīvības gatve', 'timestamp': '0:23:37'}, {'title': 'Gaisa tilts', 'timestamp': '0:36:10'}, {'title': 'Brīvības iela', 'timestamp': '0:37:43'}, {'title': 'Brīvības bulvāris', 'timestamp': '0:43:12'}, {'title': 'Kalpaka bulvāris', 'timestamp': '0:43:36'}, {'title': 'Krišjāņa Valdemāra iela', 'timestamp': '0:45:17'}, {'title': 'Vanšu tilts', 'timestamp': '0:46:58'}]",9,24042026
123,RZ65oK0zKcw,1 Hour of Swiss Alps Drive | Driving from Interlaken to Gstaad and Saanen in Switzerland [4K HDR],30062023,UCq8QA_62PxbZgqgJWtFgK0Q,8148,Immerse yourself in this Majestic drive in Switzerland starting from Interlaken and going towards Gstaad and Saanen. After arriving in Saanen we will then head towards the French border through the beautiful Swiss Alps Date: June 2023 Temp: 25 degrees,[],9,24042026
124,Zrp1j4K9vAE,Driving from Czech Republic to Poland Trutnov to Wrocław,23052025,UCsaHEEyZCmdiMcl1e_KPkXg,47381,"We are driving from Czech Republic to Poland starting our trip in Trutnov and finishing it in Wrocław. We drive on a variety of roads and through varied landscapes, from the hilly border region to the flatlands of Silesia as we approach Wrocław. We chose a different route as the direct one, to get a better glimpse of how the life goes on in this region full of history, enjoy!  Filmed in March 2025.  Please Subscribe ➤ https://www.youtube.com/channel/UCsaHEEyZCmdiMcl1e_KPkXg in order to not miss 4K road tourism videos of the nice areas I am driving through.  Route: 0:00 Intro 0:20 Trutnov 7:40 Libeč 9:42 Libeč - Zlatá Olešnice 11:23 Zlatá Olešnice 13:45 Zlatá Olešnice - Bernartice 16:43 Bernartice 18:56 Bernartice - Královec 20:30 Královec 23:01 Královec - Lubawka 24:06 Lubawka 27:30 Lubawka - S3 expressway 28:21 S3 expressway Lubawka - Bolków 48:50 S3 - Sady Dolne 49:06 Sady Dolne 49:26 Sady Dolne - Bronówek 52:16 Bronówek 52:32 Bronówek - Siodłkowice 56:38 Siodłkowice 57:04 Siodłkowice - Świebodzice 1:00:14 Świebodzice 1:03:11 Świebodzice - Mokrzeszów 1:06:17 Mokrzeszów 1:07:11 Mokrzeszów - Słotwina 1:10:52 Słotwina 1:13:05 Świdnica 1:20:40 Pszenno 1:22:15 Pszenno - Marcinowice 1:24:20 Marcinowice 1:25:50 Marcinowice - Tworzyjanów 1:31:50 Tworzyjanów 1:32:18 Tworzyjanów - Wojnarowice 1:34:55 Wojnarowice 1:35:50 Wojnarowice - Mirosławice 1:38:06 Mirosławice 1:39:01 Mirosławice - Siedlakowice 1:39:41 Siedlakowice 1:40:10 Siedlakowice - Gniechowice 1:42:15 Gniechowice 1:43:25 Gniechowice - Małuszów 1:46:22 Małuszów 1:46:53 Małuszów - Wrocław 1:58:52 Wrocław","[{'title': 'Intro', 'timestamp': '0:00:00'}, {'title': 'Trutnov', 'timestamp': '0:00:20'}, {'title': 'Libeč', 'timestamp': '0:07:40'}, {'title': 'Libeč - Zlatá Olešnice', 'timestamp': '0:09:42'}, {'title': 'Zlatá Olešnice', 'timestamp': '0:11:23'}, {'title': 'Zlatá Olešnice - Bernartice', 'timestamp': '0:13:45'}, {'title': 'Bernartice', 'timestamp': '0:16:43'}, {'title': 'Bernartice - Královec', 'timestamp': '0:18:56'}, {'title': 'Královec', 'timestamp': '0:20:30'}, {'title': 'Královec - Lubawka', 'timestamp': '0:23:01'}, {'title': 'Lubawka', 'timestamp': '0:24:06'}, {'title': 'Lubawka - S3 expressway', 'timestamp': '0:27:30'}, {'title': 'S3 expressway Lubawka - Bolków', 'timestamp': '0:28:21'}, {'title': 'S3 - Sady Dolne', 'timestamp': '0:48:50'}, {'title': 'Sady Dolne', 'timestamp': '0:49:06'}, {'title': 'Sady Dolne - Bronówek', 'timestamp': '0:49:26'}, {'title': 'Bronówek', 'timestamp': '0:52:16'}, {'title': 'Bronówek - Siodłkowice', 'timestamp': '0:52:32'}, {'title': 'Siodłkowice', 'timestamp': '0:56:38'}, {'title': 'Siodłkowice - Świebodzice', 'timestamp': '0:57:04'}, {'title': 'Świebodzice', 'timestamp': '1:00:14'}, {'title': 'Świebodzice - Mokrzeszów', 'timestamp': '1:03:11'}, {'title': 'Mokrzeszów', 'timestamp': '1:06:17'}, {'title': 'Mokrzeszów - Słotwina', 'timestamp': '1:07:11'}, {'title': 'Słotwina', 'timestamp': '1:10:52'}, {'title': 'Świdnica', 'timestamp': '1:13:05'}, {'title': 'Pszenno', 'timestamp': '1:20:40'}, {'title': 'Pszenno - Marcinowice', 'timestamp': '1:22:15'}, {'title': 'Marcinowice', 'timestamp': '1:24:20'}, {'title': 'Marcinowice - Tworzyjanów', 'timestamp': '1:25:50'}, {'title': 'Tworzyjanów', 'timestamp': '1:31:50'}, {'title': 'Tworzyjanów - Wojnarowice', 'timestamp': '1:32:18'}, {'title': 'Wojnarowice', 'timestamp': '1:34:55'}, {'title': 'Wojnarowice - Mirosławice', 'timestamp': '1:35:50'}, {'title': 'Mirosławice', 'timestamp': '1:38:06'}, {'title': 'Mirosławice - Siedlakowice', 'timestamp': '1:39:01'}, {'title': 'Siedlakowice', 'timestamp': '1:39:41'}, {'title': 'Siedlakowice - Gniechowice', 'timestamp': '1:40:10'}, {'title': 'Gniechowice', 'timestamp': '1:42:15'}, {'title': 'Gniechowice - Małuszów', 'timestamp': '1:43:25'}, {'title': 'Małuszów', 'timestamp': '1:46:22'}, {'title': 'Małuszów - Wrocław', 'timestamp': '1:46:53'}, {'title': 'Wrocław', 'timestamp': '1:58:52'}]",9,24042026
125,Q2Cvn3aK9wQ,"Scenic drive - Sofia, Bulgaria - Nea Iraklitsa, Greece part 1",25092024,UCUszl6VBXRTXa1T3QKIoj_Q,1323,"#jordansptravel #drivingtour #bulgaria #sofia #struma Join me on this scenic drive from the city of Sofia to the Greek resort sea town of Nea Iraklitsa. The video is splitted in 2 parts. On part 1, we are driving on A3 Struma highway around the Rila, Pirin and Rhodope mountains to the town of Gotse Delchev. On part 2, we will continue to Nea Iraklitsa and the Greek beach.  At first we were planning to drive through the Predel pass and the resort town of Bansko to Gotse Delchev, but it was closed due to major car accident so we went back on the highway to Kulata border crossing. We took a detour through some small rural villages on a small mountain road as there was big line at the border. This turn out to be the most beautiful part. The video was recorded on 10.07.2023. Enjoy the beautiful Bulgarian scenery!  Instagram: https://www.instagram.com/jordansptravel/ Facebook: https://www.facebook.com/JordanSPTravel  Driving videos playlist:  https://www.youtube.com/playlist?list=PLc8X4sOb2PfNTesUse5REGJgXkFubb-t4  Black Sea playlist: https://www.youtube.com/playlist?list=PLc8X4sOb2PfONB6EELZAN9KxqhUz7S410  Walking videos playlist:  https://www.youtube.com/playlist?list=PLc8X4sOb2PfMHxVEoWSO6sFGolRbbEOQA  Balkans videos playlist: https://www.youtube.com/playlist?list=PLc8X4sOb2PfP-etcnhPfbukbmG2i2juxu  Rhodope videos playlist: https://www.youtube.com/playlist?list=PLc8X4sOb2PfPZ-fRbYdGRJO7u1_0D15fx  Greece videos playlist: https://www.youtube.com/playlist?list=PLc8X4sOb2PfNx7xjumbdeNnWXgOWt6NYe  Chapters: 00:00 map 00:25 preview 01:35 Sofia 14:36 Sofia ring road 26:14 A3 ""Struma"" highway 01:33:03 Simitli, Road II-19 01:42:08 Gradevo 02:04:34 Simitli 02:06:25 Road I-1 02:24:28 Kresna 02:30:01 A3 ""Struma"" highway 02:47:24 Road III-198 02:48:55 Novo Konomladi 02:52:15 Kapatovo 02:52:23 Petrich municipality 02:53:35 Kromidovo 02:55:29 Harsovo 02:58:48 Vrania 03:01:58 Katuntsi 03:13:55 Gorno Spanchevo 03:43:55 Popovi Livadi 03:52:49 Dobrotino 04:02:17 Gotse Delchev  #relaxingdrive #scenicdrive #DriversView #TravelVideo #Travel #RoadTrip","[{'title': 'map', 'timestamp': '0:00:00'}, {'title': 'preview', 'timestamp': '0:00:25'}, {'title': 'Sofia', 'timestamp': '0:01:35'}, {'title': 'Sofia ring road', 'timestamp': '0:14:36'}, {'title': 'A3 ""Struma"" highway', 'timestamp': '0:26:14'}, {'title': 'Simitli, Road II-19', 'timestamp': '1:33:03'}, {'title': 'Gradevo', 'timestamp': '1:42:08'}, {'title': 'Simitli', 'timestamp': '2:04:34'}, {'title': 'Road I-1', 'timestamp': '2:06:25'}, {'title': 'Kresna', 'timestamp': '2:24:28'}, {'title': 'A3 ""Struma"" highway', 'timestamp': '2:30:01'}, {'title': 'Road III-198', 'timestamp': '2:47:24'}, {'title': 'Novo Konomladi', 'timestamp': '2:48:55'}, {'title': 'Kapatovo', 'timestamp': '2:52:15'}, {'title': 'Petrich municipality', 'timestamp': '2:52:23'}, {'title': 'Kromidovo', 'timestamp': '2:53:35'}, {'title': 'Harsovo', 'timestamp': '2:55:29'}, {'title': 'Vrania', 'timestamp': '2:58:48'}, {'title': 'Katuntsi', 'timestamp': '3:01:58'}, {'title': 'Gorno Spanchevo', 'timestamp': '3:13:55'}, {'title': 'Popovi Livadi', 'timestamp': '3:43:55'}, {'title': 'Dobrotino', 'timestamp': '3:52:49'}, {'title': 'Gotse Delchev', 'timestamp': '4:02:17'}]",9,24042026
126,DqWyMpAbRpo,Drive DN1 | Bucuresti - Ploiesti - Brasov | Romania | 2023,03062023,UC8_7cWET-AU1lUFc5OELpRQ,8679,"*DN1 | Bucuresti - Ploiesti - Brasov*  #spotyourroad #bucuresti #ploiesti #brasov #romania #dn1 #drive #road   Filmarea incepe de la kilometrul 0  Bucuresti pana la intrare in Brasov.  Abonați-vă la acest canal dacă apreciați conținutul postat și efortul depus. Lăsați un comentariu cu sugestii și recomandări cu privire la ce doriți să vizualizați pe acest canal.  Route map: https://www.google.com/maps/d/u/0/edit?mid=1IYeoJ4PC9MGT0POu5s0JBTwR6oLZBR0&usp=sharing  Data: 22 Aprilie 2023  Traseu: 00:00:00 București - Km0, Piața Sf. Gheorghe, Bulevardul Ion C. Brătianu 00:01:03 București - Bulevardul Nicolae Bălcescu 00:03:10 București - Bulevardul Lascăr Catargiu 00:04:18 București - Piața Victoriei 00:04:34 București - Bulevardul Aviatorilor 00:06:52 București - Piața Charles de Gaulle 00:07:20 București - Bulevardul Mareșal Constantin Prezan 00:09:10 București - Piața Arcul de Triumf 00:09:21 București - Bulevardul Regele Mihai I al României 00:11:14 București - Piața Presei Libere 00:11:25 București - Șoseaua București-Ploiești 00:16:25 Ieșire București 00:17:00 Orașul Otopeni, Ilfov 00:21:02 Orașul Otopeni - Comuna Balotești 00:22:50 Comuna Balotești, Ilfov 00:23:37 Comuna Balotești - Satul Săftica 00:23:58 Satul Săftica, Ilfov 00:25:59 Satul Săftica - Satul Tâncăbești 00:28:04 Satul Tâncăbești, Ilfov 00:29:32 Satul Tâncăbești - Comuna Ciolpani 00:31:22 Comuna Ciolpani, Ilfov 00:34:16 Comuna Ciolpani - Satul Potigrafu 00:36:09 Satul Potigrafu, Prahova 00:37:30 Satul Potigrafu - Satul Puchenii-Moșneni 00:38:04 Satul Puchenii-Moșneni, Prahova 00:39:42 Comuna Puchenii Mari, Prahova 00:40:30 Comuna Puchenii Mari - Satul Românești 00:41:45 Satul Românești, Prahova 00:43:20 Comuna Bărcănești, Prahova 00:45:07 Centura de Vest Ploieşti, Prahova 00:53:55 Orașul Ploiești - Comuna Bănești 01:06:08 Comuna Bănești, Prahova 01:07:11 Comuna Bănești - Satul Nistorești 01:14:54 Satul Nistorești, Prahova 01:16:12 Satul Nistorești - Oraşul Comarnic 01:16:58 Oraşul Comarnic, Prahova 01:22:03 Oraşul Comarnic - Satul Posada 01:23:29 Satul Posada, Prahova 01:24:32 Satul Posada - Orașul Sinaia 01:29:40 Orașul Sinaia, Prahova 01:37:11 Orașul Sinaia - Orașul Bușteni 01:39:47 Orașul Bușteni, Prahova 01:45:44 Orașul Bușteni - Orașul Azuga 01:48:00 Orașul Azuga, Prahova 01:49:32 Orașul Azuga - Oraşul Predeal 01:52:21 Oraşul Predeal, Brașov 01:57:47 Oraşul Predeal - Satul Timișu de Sus 02:02:23 Satul Timișu de Sus, Brașov 02:04:31 Satul Timișu de Sus - Municipiul Brașov 02:11:59 Municipiul Brașov 02:13:14 Municipiul Brașov - Calea București/DN1/E60 Stop","[{'title': 'București - Km0, Piața Sf. Gheorghe, Bulevardul Ion C. Brătianu', 'timestamp': '0:00:00'}, {'title': 'București - Bulevardul Nicolae Bălcescu', 'timestamp': '0:01:03'}, {'title': 'București - Bulevardul Lascăr Catargiu', 'timestamp': '0:03:10'}, {'title': 'București - Piața Victoriei', 'timestamp': '0:04:18'}, {'title': 'București - Bulevardul Aviatorilor', 'timestamp': '0:04:34'}, {'title': 'București - Piața Charles de Gaulle', 'timestamp': '0:06:52'}, {'title': 'București - Bulevardul Mareșal Constantin Prezan', 'timestamp': '0:07:20'}, {'title': 'București - Piața Arcul de Triumf', 'timestamp': '0:09:10'}, {'title': 'București - Bulevardul Regele Mihai I al României', 'timestamp': '0:09:21'}, {'title': 'București - Piața Presei Libere', 'timestamp': '0:11:14'}, {'title': 'București - Șoseaua București-Ploiești', 'timestamp': '0:11:25'}, {'title': 'Ieșire București', 'timestamp': '0:16:25'}, {'title': 'Orașul Otopeni, Ilfov', 'timestamp': '0:17:00'}, {'title': 'Orașul Otopeni - Comuna Balotești', 'timestamp': '0:21:02'}, {'title': 'Comuna Balotești, Ilfov', 'timestamp': '0:22:50'}, {'title': 'Comuna Balotești - Satul Săftica', 'timestamp': '0:23:37'}, {'title': 'Satul Săftica, Ilfov', 'timestamp': '0:23:58'}, {'title': 'Satul Săftica - Satul Tâncăbești', 'timestamp': '0:25:59'}, {'title': 'Satul Tâncăbești, Ilfov', 'timestamp': '0:28:04'}, {'title': 'Satul Tâncăbești - Comuna Ciolpani', 'timestamp': '0:29:32'}, {'title': 'Comuna Ciolpani, Ilfov', 'timestamp': '0:31:22'}, {'title': 'Comuna Ciolpani - Satul Potigrafu', 'timestamp': '0:34:16'}, {'title': 'Satul Potigrafu, Prahova', 'timestamp': '0:36:09'}, {'title': 'Satul Potigrafu - Satul Puchenii-Moșneni', 'timestamp': '0:37:30'}, {'title': 'Satul Puchenii-Moșneni, Prahova', 'timestamp': '0:38:04'}, {'title': 'Comuna Puchenii Mari, Prahova', 'timestamp': '0:39:42'}, {'title': 'Comuna Puchenii Mari - Satul Românești', 'timestamp': '0:40:30'}, {'title': 'Satul Românești, Prahova', 'timestamp': '0:41:45'}, {'title': 'Comuna Bărcănești, Prahova', 'timestamp': '0:43:20'}, {'title': 'Centura de Vest Ploieşti, Prahova', 'timestamp': '0:45:07'}, {'title': 'Orașul Ploiești - Comuna Bănești', 'timestamp': '0:53:55'}, {'title': 'Comuna Bănești, Prahova', 'timestamp': '1:06:08'}, {'title': 'Comuna Bănești - Satul Nistorești', 'timestamp': '1:07:11'}, {'title': 'Satul Nistorești, Prahova', 'timestamp': '1:14:54'}, {'title': 'Satul Nistorești - Oraşul Comarnic', 'timestamp': '1:16:12'}, {'title': 'Oraşul Comarnic, Prahova', 'timestamp': '1:16:58'}, {'title': 'Oraşul Comarnic - Satul Posada', 'timestamp': '1:22:03'}, {'title': 'Satul Posada, Prahova', 'timestamp': '1:23:29'}, {'title': 'Satul Posada - Orașul Sinaia', 'timestamp': '1:24:32'}, {'title': 'Orașul Sinaia, Prahova', 'timestamp': '1:29:40'}, {'title': 'Orașul Sinaia - Orașul Bușteni', 'timestamp': '1:37:11'}, {'title': 'Orașul Bușteni, Prahova', 'timestamp': '1:39:47'}, {'title': 'Orașul Bușteni - Orașul Azuga', 'timestamp': '1:45:44'}, {'title': 'Orașul Azuga, Prahova', 'timestamp': '1:48:00'}, {'title': 'Orașul Azuga - Oraşul Predeal', 'timestamp': '1:49:32'}, {'title': 'Oraşul Predeal, Brașov', 'timestamp': '1:52:21'}, {'title': 'Oraşul Predeal - Satul Timișu de Sus', 'timestamp': '1:57:47'}, {'title': 'Satul Timișu de Sus, Brașov', 'timestamp': '2:02:23'}, {'title': 'Satul Timișu de Sus - Municipiul Brașov', 'timestamp': '2:04:31'}, {'title': 'Municipiul Brașov', 'timestamp': '2:11:59'}, {'title': 'Municipiul Brașov - Calea București/DN1/E60', 'timestamp': '2:13:14'}]",9,24042026
127,7QRzYn0Iykg,Driving in Holland 🇳🇱 From Kampen to Harderwijk,01072022,UCcwGwvM5iPB9IvtTnMTVcEg,15324,"Today you will be in the driver's seat while driving on rural roads from Kampen to Harderwijk in the Netherlands 🛑Please Subscribe➤http://bit.ly/-STV  Sit Back, Relax, and Enjoy watching this FULL-length scenic road trip video in 4K quality.  This Relaxing Video is best watched on a 4K big-screen TV with your legs stretched out on a big comfy couch. Optional, mute the video sound and play your favorite music along with the video.  ---------- Route Info ---------- ◎ Drive Date: May 1, 2022 ◎ Start: Kampen, Netherlands ◎ End: Harderwijk, Netherlands ◎ Drive Distance: 45 km / 28 mi ◎ Drive Time: 1 Hour 6 Minutes ◎ Route: https://goo.gl/maps/qva9xyRG1fbtwD7J6  ---------- Places and Interesting points along the route ---------- • 0:00 - Kampen, Netherlands • 24:04 - Kerkdorp, Gem. Oldebroek, Netherlands • 27:19 - Oosterwolde, Netherlands • 32:59 - Oostendorp, Netherlands • 37:03 - Elburg, Netherlands • 40:21 - Doornspijk, Netherlands • 43:54 - Nunspeet, Netherlands • 50:53 - Hulshorst, Netherlands • 55:08 - Hierden, Netherlands • 58:38 - Harderwijk, Netherlands  ◉Website: http://SigisTravelVideos.com ◉See all our Trips on Google MyMaps: https://bit.ly/SigisTrips  ***Other YouTube Channels*** 🔹VMC Aviation Videos: https://bit.ly/3dBD5a7 🔹NO BULL 4K Road Trips: https://bit.ly/3a3VNGK​​ 🔹4K Scenic Relaxation: https://bit.ly/3tJXAZC​​ 🔹iLoveMyCats: https://bit.ly/3711vY1​  #Kampen #Harderwijk #Netherlands #Holland #RoadTrip #Screensaver #DriversView #TravelVideo #CarDrive #Travel #DashCam #ScenicDrive #RoadTravel","[{'title': 'Kampen, Netherlands', 'timestamp': '0:00:00'}, {'title': 'Kerkdorp, Gem. Oldebroek, Netherlands', 'timestamp': '0:24:04'}, {'title': 'Oosterwolde, Netherlands', 'timestamp': '0:27:19'}, {'title': 'Oostendorp, Netherlands', 'timestamp': '0:32:59'}, {'title': 'Elburg, Netherlands', 'timestamp': '0:37:03'}, {'title': 'Doornspijk, Netherlands', 'timestamp': '0:40:21'}, {'title': 'Nunspeet, Netherlands', 'timestamp': '0:43:54'}, {'title': 'Hulshorst, Netherlands', 'timestamp': '0:50:53'}, {'title': 'Hierden, Netherlands', 'timestamp': '0:55:08'}, {'title': 'Harderwijk, Netherlands', 'timestamp': '0:58:38'}]",8,24042026
128,N3sk3HU3kJ4,Driving Around the Entire Coastline of Nauru in 30 Minutes!,04032024,UCc44EwbrUfM36gpu_Yx0I9A,2557,This is a drive recorded in one of the smallest countries in the world Nauru which is an Island Nation located in the Pacific Ocean.,[],8,24042026
129,sZ6SfzGtmJw,Lausanne to Montreux 4K | Driving in Switzerland Lake Road,16082020,UC_NIn-5xAeAJhT-I84v-QLw,30838,"Enjoy this 1h long drive on this scenic route along the Lake Geneva(Lac Léman) from Lausanne to Montreux. Lac Léman, a small silver sea surrounded by snowy summits and vineyards, e.g. UNESCO World Heritage Lavaux.   00:00 - Lausanne 07:10 - Lutry 11:12 - Villette 20:36 - Rivaz 21:47 - St. Saphorin 24:15 - Corseaux 27:30 - Vevey 33:15 - La Tour-de-Peilz 37:31 - Clarens 42:20 - Montreux  Don't forget to check my other driving videos https://youtube.com/playlist?list=PLJBqDFKqGGx6Frj9mkK5-R0h-HPR-U6Ol  ★☆★ CONNECT WITH DIVVERSE ON SOCIAL MEDIA ★☆★  Facebook: https://www.facebook.com/divverse99 Twitter: https://twitter.com/DIVVERSE2 Instagram: https://www.instagram.com/divverse_/  Make sure to subscribe and click the notification bell so you never miss a video!  #Switzerland #Lausanne #Montreux","[{'title': 'Lausanne', 'timestamp': '0:00:00'}, {'title': 'Lutry', 'timestamp': '0:07:10'}, {'title': 'Villette', 'timestamp': '0:11:12'}, {'title': 'Rivaz', 'timestamp': '0:20:36'}, {'title': 'St. Saphorin', 'timestamp': '0:21:47'}, {'title': 'Corseaux', 'timestamp': '0:24:15'}, {'title': 'Vevey', 'timestamp': '0:27:30'}, {'title': 'La Tour-de-Peilz', 'timestamp': '0:33:15'}, {'title': 'Clarens', 'timestamp': '0:37:31'}, {'title': 'Montreux', 'timestamp': '0:42:20'}]",8,24042026
130,_C4ibXyORHo,Relaxing drive Bulgaria - Varna - Slanchev Bryag (Sunny beach) / Варна - Слънчев Бряг,16092023,UCUszl6VBXRTXa1T3QKIoj_Q,1577,"#jordansptravel #bulgaria #varna #byala #obzor #sunnybeach #drivingtour Join me in this relaxing drive from the city of Varna to the Black Sea resort of Slanchev Briag (Sunny Beach). We will drive through small summer villages and resorts and the Eastern end of the Balkans mountain range with a few spectacular sea views. The video was recorded on 11.09.2022. Enjoy the beautiful Bulgarian countryside!  Instagram: https://www.instagram.com/jordansptravel/ Facebook: https://www.facebook.com/JordanSPTravel  Driving videos playlist:  https://www.youtube.com/playlist?list=PLc8X4sOb2PfNTesUse5REGJgXkFubb-t4  Black Sea playlist:  https://www.youtube.com/playlist?list=PLc8X4sOb2PfONB6EELZAN9KxqhUz7S410  Walking videos playlist:  https://www.youtube.com/playlist?list=PLc8X4sOb2PfMHxVEoWSO6sFGolRbbEOQA  Balkans videos playlist:  https://www.youtube.com/playlist?list=PLc8X4sOb2PfP-etcnhPfbukbmG2i2juxu  Rhodope videos playlist: https://www.youtube.com/playlist?list=PLc8X4sOb2PfPZ-fRbYdGRJO7u1_0D15fx  Greece videos playlist: https://www.youtube.com/playlist?list=PLc8X4sOb2PfNx7xjumbdeNnWXgOWt6NYe  Chapters: 00:00 map 00:22 preview 01:21 Vinitsa 13:44 City center 19:19 Asparuhov bridge 22:50 A5 ""Cherno more"" (Black sea) highway 28:02 Avren municipality 28:11 Road I-9 30:58 Priseltsi 46:02 Staro Oryahovo 56:51 Byala municipality 01:00:42 Goritsa 01:04:27 Byala 01:10:30 Obzor, Burgas region 01:14:02 Obzor pass 01:26:05 Banya 01:48:53 Nessebar 01:49:49 Slanchev Briag (Sunny Beach) resort  Music in the video: Provided to YouTube by YouTube Audio Library Love Aside • Patrick Patrikios Love Aside ℗ YouTube Audio Library Released on: 2020-12-01 Auto-generated by YouTube.  #relaxingdrive #scenicdrive #DriversView #TravelVideo #Travel #RoadTrip","[{'title': 'map', 'timestamp': '0:00:00'}, {'title': 'preview', 'timestamp': '0:00:22'}, {'title': 'Vinitsa', 'timestamp': '0:01:21'}, {'title': 'City center', 'timestamp': '0:13:44'}, {'title': 'Asparuhov bridge', 'timestamp': '0:19:19'}, {'title': 'A5 ""Cherno more"" (Black sea) highway', 'timestamp': '0:22:50'}, {'title': 'Avren municipality', 'timestamp': '0:28:02'}, {'title': 'Road I-9', 'timestamp': '0:28:11'}, {'title': 'Priseltsi', 'timestamp': '0:30:58'}, {'title': 'Staro Oryahovo', 'timestamp': '0:46:02'}, {'title': 'Byala municipality', 'timestamp': '0:56:51'}, {'title': 'Goritsa', 'timestamp': '1:00:42'}, {'title': 'Byala', 'timestamp': '1:04:27'}, {'title': 'Obzor, Burgas region', 'timestamp': '1:10:30'}, {'title': 'Obzor pass', 'timestamp': '1:14:02'}, {'title': 'Banya', 'timestamp': '1:26:05'}, {'title': 'Nessebar', 'timestamp': '1:48:53'}, {'title': 'Slanchev Briag (Sunny Beach) resort', 'timestamp': '1:49:49'}]",8,24042026
