id,video,title,upload_date,channel,views,description,chapters,segments,date_updated
1,ID_q1RC_dSo,{DRIVING KENYA} NAIROBI  CITY TO MERU SOUTH // THARAKA NITHI // ROAD TRIP!!,31082024.0,UCmKcQFlFJjc4ruSf2clPM-w,1336,"4K VIDEO {DRIVING KENYA} NAIROBI  CITY TO MERU SOUTH // THARAKA NITHI // ROAD TRIP!!  Nairobi is the capital and largest city of Kenya. The name is derived from the Maasai phrase, which translates to 'place of cool waters', a reference to the Nairobi River which flows through the city.  Tharaka-Nithi County is one of the 47 counties of Kenya. It was created from Kenya's Eastern Province. The county has an area of 2609 km² and as of the 2019 census a population of 393,177. Tharaka-Nithi County is home to the Chuka, Muthambi, Mwimbi and Tharaka subgroups of the Ameru community.  🔴 RECOMMENDED VIDEOS/PLAYLISTS 🎥 Mbeya to Kasumulu Border post 🎥 Songwe Border Post to Lilongwe  🎥 Not What I Expected Driving from Dedza/Camolue Border Post to Tete Town MOZAMBIQUE! Video 🎥 Driving from NYAMAPANDA BORDER POST to HARARE ZIMBABWE scenic views !!! 🎥 Driving from BULAWAYO CITY to VICTORIA FALLS Border Post Scenic Views!! 🎥 Driving from HARARE CITY to BEITBRIDGE BORDER Town Scenic Views!!!   🔴 *** BE MY FRIEND ***   ✅ Instagram: https://instagram.com/the_african_adventurer_diaries/  ✅ Facebook: https://facebook.com/the_african_adventurer_diaries/  ✅ TikTok: https://www.tiktok.com/@theafricanadventurediary    🔴 *** ABOUT THE CHANNEL *** Welcome to my travel vlog! Join us as we embark on epic road trips, capturing breathtaking scenery, immersive cultures, and unforgettable experiences. My channel showcases the entire routes we follow during our journeys, giving you a real taste of the adventure. From hidden gems to popular destinations, our travel videos and vlogs will inspire you to explore the world. So buckle up, subscribe, and let's hit the road together!  Thank you for taking your time to visit my channel.  💡 TOPICS IN THIS VIDEO 💡 • Driving in Kenya • Nairobi  City • Kenya Road Trip • Road trip • Driving • Adventure • Kenya Tourism • Kenya • Thika Road • Nairobi Kenya  🔎 HASHTAGS 🔎 #drivinginkenya  #nairobicity   #Tharakanithicounty  #nairobivlog  #roadtrip #Merusouth  #adventure #nairobinews  #kenyaroads  #driving #roadtripping  #travel #africatravelvlog  #africaadventures   #adventure  #adventureinafrica #drivingexperience  #kenyavlog",[],20,22112025
2,lVMHKECK_kI,Going from Timisoara (Romania) to Sofia (Bulgaria),14052018.0,UCyw7oIZalTvrDJOsD703U3Q,1979,Road trips over highway or European roads. Get more travel tips and information on http://traveleurope.ro,[],15,3062025
3,XsQuWRGgGNk,DRIVING FROM VORARLBERG (AUSTRIA) to VADUZ (LIECHTENSTEIN) I 4K 60fps,14102021.0,UCOTltJnsvy8V9ku46nARF6w,25462,"On this unique route, we start from the Alpine part of Western Austria to one of the smallest countries in the world, we cross Liechtenstein and its capital Vaduz and we can observe the tiny extent of this small Alpine country ... surprising !!  First of all, I would like to apologize for the small annoying noises in some parts of the video, I am trying not to repeat them in future videos 🥰🥰🥰  Route: https://goo.gl/maps/xcUBMuxG7Lo5319SA  To fully enjoy viewing, I recommend watching the videos on a 4K screen and setting the YouTube Player (lower wheel) to the maximum quality, 2160p60.  00:00:00 START 00:01:43 RAGGAL 00:10:02 THÜRINGEN 00:11:55 BLUDESCH 00:15:45 SCHLINS 00:23:02 GÖFIS 00:28:44 SCHATTENBURG 00:29:05 FELDKIRCH 00:34:01 BORDER AUSTRIA-LIECHTENSTEIN 00:45:39 VADUZ 00:49:51 REGIERUNGSGEBÄUDE 00:50:53 KUNSTMUSEUM  00:51:26 VADUZ TOWN HALL 00:52:40 LIECHTENSTEIN TREASURY 00:53:01 ST. FLORIN CATHEDRAL  Equipment used for recording: Camera https://amzn.to/3wSYvXU Memory Card https://amzn.to/3rmwIhn Suction Cup https://amzn.to/3wV9kZk External Battery https://amzn.to/3eGGTIA  Don't miss our video in Zurich: https://youtu.be/2obsKLoZQdU  Do you want to know more about me? Come on, follow me!! https://www.instagram.com/just_driving_4k https://www.facebook.com/JustDriving4K https://twitter.com/4k_just  If you like the channel and want to continue watching my routes, subscribe here and leave a comment, I will be happy to answer you 💗💗💗https://www.youtube.com/channel/UCOTltJnsvy8V9ku46nARF6w?sub_confirmation=1","[{'title': 'START', 'timestamp': '0:00:00'}, {'title': 'RAGGAL', 'timestamp': '0:01:43'}, {'title': 'THÜRINGEN', 'timestamp': '0:10:02'}, {'title': 'BLUDESCH', 'timestamp': '0:11:55'}, {'title': 'SCHLINS', 'timestamp': '0:15:45'}, {'title': 'GÖFIS', 'timestamp': '0:23:02'}, {'title': 'SCHATTENBURG', 'timestamp': '0:28:44'}, {'title': 'FELDKIRCH', 'timestamp': '0:29:05'}, {'title': 'BORDER AUSTRIA-LIECHTENSTEIN', 'timestamp': '0:34:01'}, {'title': 'VADUZ', 'timestamp': '0:45:39'}, {'title': 'REGIERUNGSGEBÄUDE', 'timestamp': '0:49:51'}, {'title': 'KUNSTMUSEUM', 'timestamp': '0:50:53'}, {'title': 'VADUZ TOWN HALL', 'timestamp': '0:51:26'}, {'title': 'LIECHTENSTEIN TREASURY', 'timestamp': '0:52:40'}, {'title': 'ST. FLORIN CATHEDRAL', 'timestamp': '0:53:01'}]",13,3062025
4,7NSGFFb_YJs,Italian Riviera 4K - Yachts & Seaside Resorts - Scenic Drive,10072021.0,UCBcVQr-07MH-p9e2kRTdB3A,375745,"Afternoon drive along the Italian Riviera, from the major seaport city of Genoa (Genova) to the picturesque harbour of Portofino.  Parking for YOUR Superyatch at Portofino is only $75,000 per month! ;) Yachts, cliffs, beaches, colorfully painted resorts, amazing Italian culture, along the Italian coastline.  I love Italian cities (I want to get an electric car or a motorcycle so I can ride in the ZTL) but the coastline is another level! Lots of American popular culture over the past 30 years focused Italy.  And the Italian coastline is a great representation of what makes Italy so great!  Hopefully this video helps until you get to visit in person! Starting Point:  https://goo.gl/maps/foicj9yXZ5biSgmF9 . The Italian Riviera.  As a tourist centre, the Italian Riviera benefits from over 300 days of sunshine per year, and is known for its beaches, colourfully painted towns, natural environment, food, and luxury villas and hotels, as well as for its popular resort facilities, major yachting and cruising areas with several marinas, festivals, golf courses, sailing, rock climbing and scenic views of centuries old farmhouses and cottages.  The Italian Riviera, or Ligurian Riviera, is the narrow coastal strip in Italy which lies between the Ligurian Sea and the mountain chain formed by the Maritime Alps and the Apennines. Longitudinally it extends from the border with France and the French Riviera (or Côte d'Azur) near Ventimiglia (a former customs post) eastwards to Capo Corvo (also known as Punta Bianca) which marks the eastern end of the Gulf of La Spezia and is close to the regional border between Liguria and Tuscany.   The mild climate draws an active tourist trade in the numerous coastal resorts, which include Alassio, Bonassola, Bordighera, Camogli, Cinque Terre, Lerici, Levanto, Noli, Portofino, Porto Venere, Santa Margherita Ligure, Sanremo, San Fruttuoso, and Sestri Levante. It is also known for its historical association with international celebrity and artistic visitors; writers and poets like Percy Bysshe Shelley, Lord Byron, Ezra Pound, and Ernest Hemingway were inspired by the beauty and spirit of the region.  Industries are concentrated in and around Genoa, Savona, and along the shores of the Gulf of La Spezia. Genoa and La Spezia are Italy’s leading shipyards; La Spezia is Italy’s major naval base, and Savona is a major centre of the Italian iron industry. Chemical, textile, and food industries are also important.  A number of streets and palaces in the center of Genoa and the Cinque Terre National Park (which includes Cinque Terre, Portovenere, and the islands Palmaria, Tino and Tinetto) are two of Italy's 55 World Heritage Sites.  https://en.wikipedia.org/wiki/Italian_Riviera  Genoa is the capital of the Italian region of Liguria and the sixth-largest city in Italy.  Genoa has historically been one of the most important ports on the Mediterranean: it is currently the busiest in Italy and in the Mediterranean Sea and twelfth-busiest in the European Union.  Genoa was the capital of one of the most powerful maritime republics for over seven centuries, from the 11th century to 1797. Particularly from the 12th century to the 15th century, the city played a leading role in the commercial trade in Europe, becoming one of the largest naval powers of the continent and considered among the wealthiest cities in the world.  https://en.wikipedia.org/wiki/Genoa  Portofino (Portofin) is an Italian fishing village and holiday resort famous for its picturesque harbour and historical association with celebrity and artistic visitors. It is a comune located in the Metropolitan City of Genoa on the Italian Riviera. The town is clustered around its small harbour, and is known for the colourfully painted buildings that line the shore.  In Popular Culture: - In 1959 Dalida released song ""Love in Portofino"", written by Leo Chiosso and composed by Fred Buscaglione. With lyrics in French and Italian language, it became a hit and was later iconised alongside the village's name. It also spawned several international covers, including Andrea Bocelli's in 2013 which was followed by a concert recorded and issued on DVD. - Portofino is the eponym of Frank Schaeffer's Portofino: A Novel (1992). It was the first of Schaeffer's Calvin Becker Trilogy. - There is a full-scale replica, in authentic detail, of Portofino Bay at Universal Orlando Resort in Orlando, USA, which opened in September 1999. - Portofino inspired in 2001 a recreation of the seaside town in the Mediterranean Harbor area at Tokyo Disney Sea in Chiba, Japan. It also served as the namesake for the restaurant Cafe Portofino. - Portofino was featured in 2008 in the television series Top Gear (Episode 5, Series 12). Richard Hammond, in a Ferrari Daytona raced James May in a carbon fibre powerboat from Portofino to St Tropez in France. - Ferrari named one of their new V8 sports cars after Portofino in 2017.  https://en.wikipedia.org/wiki/Portofino",[],12,3062025
5,UM27EIAsq28,{DRIVING KENYA} ENA EMBU TO MERU TOWN // NEW ROUTE // KENYA // AFRICA,28092024.0,UCmKcQFlFJjc4ruSf2clPM-w,513,"{DRIVING KENYA} ENA EMBU TO MERU TOWN // NEW ROUTE // KENYA // AFRICA  Embu is a town located approximately 125 kilometres northeast of Nairobi towards Mount Kenya. Embu served as the provincial capital of the former Eastern Province and currently serves as the headquarters of Embu County in Kenya.  Meru County is one of the 47 counties of Kenya. It borders Isiolo County to the north, Tharaka-Nithi County to the South, Nyeri County to the southwest and Laikipia County to the west. The home of the Meru people, Meru County has a population of 1.35 million people. The county headquarters are in Meru town.  🔴 RECOMMENDED VIDEOS/PLAYLISTS 🎥 Mbeya to Kasumulu Border post 🎥 Songwe Border Post to Lilongwe  🎥 Not What I Expected Driving from Dedza/Camolue Border Post to Tete Town MOZAMBIQUE! Video 🎥 Driving from NYAMAPANDA BORDER POST to HARARE ZIMBABWE scenic views !!! 🎥 Driving from BULAWAYO CITY to VICTORIA FALLS Border Post Scenic Views!! 🎥 Driving from HARARE CITY to BEITBRIDGE BORDER Town Scenic Views!!!   🔴 *** BE MY FRIEND ***   ✅ Instagram: https://instagram.com/the_african_adventurer_diaries/  ✅ Facebook: https://facebook.com/the_african_adventurer_diaries/  ✅ TikTok: https://www.tiktok.com/@theafricanadventurediary    🔴 *** ABOUT THE CHANNEL *** Welcome to my travel vlog! Join us as we embark on epic road trips, capturing breathtaking scenery, immersive cultures, and unforgettable experiences. My channel showcases the entire routes we follow during our journeys, giving you a real taste of the adventure. From hidden gems to popular destinations, our travel videos and vlogs will inspire you to explore the world. So buckle up, subscribe, and let's hit the road together!  Thank you for taking your time to visit my channel.  💡 TOPICS IN THIS VIDEO 💡 • Driving in Kenya • Meru County • Kenya Road Trip • Road trip • Driving • Adventure • Kenya Tourism • Kenya • Meru -Nairobi Highway • Embu County  🔎 HASHTAGS 🔎 #drivinginkenya  #nairobicity   #Tharakanithicounty  #nairobivlog  #roadtrip #Merusouth  #adventure #nairobinews  #kenyaroads  #driving #roadtripping  #travel #africatravelvlog  #africaadventures   #adventure  #adventureinafrica #drivingexperience  #kenyavlog",[],13,22112025
6,Z0Y1qIWhDU0,Liechtenstein | Drive through the most beautiful villages | 4K,27092022.0,UCOpfzYU2yx_D4Ve1qJqfyhA,19445,Liechtenstein | Drive through the most beautiful villages Liechtenstein is the 4th smallest country in Europe. The direct neighbors are Switzerland and Austria.  There is no border between Switzerland and Liechtenstein. Liechtenstein has been part of the Swiss economic area since 1923.  Accompany me on a tour (57 km) through wonderful villages in Liechtenstein.  THANK YOU FOR WATCHING MY CHANNEL. Please support my channel by subscribing  00:00  BALZERS 06:18  TRIESEN 11:50  VADUZ 18:42  SCHAAN 25:00  NENDELN 27:14  SCHAANWALD 28:32  MAUREN 33:30  SCHELLENBERG 38:01  RUGGELL 42:41  BENDERN 48:39  SCHAAN 52:48  VADUZ 59:18  TRIESEN 1:04:36  Balzers  INFO LIECHTENSTEIN:  https://www.google.com/maps/place/Liechtenstein,"[{'title': 'BALZERS', 'timestamp': '0:00:00'}, {'title': 'TRIESEN', 'timestamp': '0:06:18'}, {'title': 'VADUZ', 'timestamp': '0:11:50'}, {'title': 'SCHAAN', 'timestamp': '0:18:42'}, {'title': 'NENDELN', 'timestamp': '0:25:00'}, {'title': 'SCHAANWALD', 'timestamp': '0:27:14'}, {'title': 'MAUREN', 'timestamp': '0:28:32'}, {'title': 'SCHELLENBERG', 'timestamp': '0:33:30'}, {'title': 'RUGGELL', 'timestamp': '0:38:01'}, {'title': 'BENDERN', 'timestamp': '0:42:41'}, {'title': 'SCHAAN', 'timestamp': '0:48:39'}, {'title': 'VADUZ', 'timestamp': '0:52:48'}, {'title': 'TRIESEN', 'timestamp': '0:59:18'}, {'title': 'Balzers', 'timestamp': '1:04:36'}]",14,3062025
7,c50dvV6VALQ,Jersey Channel Islands Coastal drive (No Sound),17032019.0,UCYVw95O41nx7AF1f5S_viJw,3146,,[],22,3062025
8,sJ3kqMsF6gw,4K Liechtenstein Drive | Balzers - Vaduz - Gams (Switzerland),5012024.0,UC12FUHVhwpC5lMYsMPMbmyg,16033,"The drive starts at the south border to Switzerland,  visits Vaduz, the capital of Liechtenstein, and ends at Gams in Switzerland.  Google Maps route: https://maps.app.goo.gl/MSHTtUHA4Yxi42HNA  00:00 Balzers to Central Vaduz 13:00 Central Vaduz to Nendln 24:42 Nendln to Gams, Switzerland  Date: 2023/7/15 Camera: GH6 + HSA12035 Music: Swans In Flight - Asher Fulero from YouTube Audio Library","[{'title': 'Balzers to Central Vaduz', 'timestamp': '0:00:00'}, {'title': 'Central Vaduz to Nendln', 'timestamp': '0:13:00'}, {'title': 'Nendln to Gams, Switzerland', 'timestamp': '0:24:42'}]",10,3062025
9,iwGu-xTFNgE,{DRIVING EAST AFRICA} ARUSHA TANZANIA TO NAIROBI KENYA VIA NAMANGA ONE STOP BORDER POST,17082024.0,UCmKcQFlFJjc4ruSf2clPM-w,1653,"{DRIVING EAST AFRICA} ARUSHA TANZANIA TO NAIROBI KENYA VIA NAMANGA ONE STOP BORDER POST  Arusha is a city in East Africa's Tanzania, located at the base of volcanic Mt. Meru. It's a gateway to safari destinations and to Africa's highest peak, 5,895m Mt. Kilimanjaro, lying some 100 kilometers northeast. To the west lies Serengeti National Park, home to wildlife including lions, rhinoceros, giraffes and leopards. Annual migrations feature huge herds of wildebeests crossing its plains.  Nairobi is Kenya’s capital city. In addition to its urban core, the city has Nairobi National Park, a large game reserve known for breeding endangered black rhinos and home to giraffes, zebras and lions. Next to it is a well-regarded elephant orphanage operated by the David Sheldrick Wildlife Trust. Nairobi is also often used as a jumping-off point for safari trips elsewhere in Kenya.   🔴 RECOMMENDED VIDEOS/PLAYLISTS 🎥 Mbeya to Kasumulu Border post 🎥 Songwe Border Post to Lilongwe  🎥 Not What I Expected Driving from Dedza/Camolue Border Post to Tete Town MOZAMBIQUE! Video 🎥 Driving from NYAMAPANDA BORDER POST to HARARE ZIMBABWE scenic views !!! 🎥 Driving from BULAWAYO CITY to VICTORIA FALLS Border Post Scenic Views!! 🎥 Driving from HARARE CITY to BEITBRIDGE BORDER Town Scenic Views!!! 🔴 *** BE MY FRIEND ***  ✅ Instagram: https://instagram.com/the_african_adventurer_diaries/  ✅ Facebook: https://facebook.com/the_african_adventurer_diaries/  ✅ TikTok: https://www.tiktok.com/@theafricanadventurediary  🔴 *** ABOUT THE CHANNEL *** Welcome to my travel vlog! Join us as we embark on epic road trips, capturing breathtaking scenery, immersive cultures, and unforgettable experiences. My channel showcases the entire routes we follow during our journeys, giving you a real taste of the adventure. From hidden gems to popular destinations, our travel videos and vlogs will inspire you to explore the world. So buckle up, subscribe, and let's hit the road together!  Thank you for taking your time to visit my channel.  💡 TOPICS IN THIS VIDEO 💡 • Driving in East Africa • Arusha,Tanzania • Nairobi,Kenya • Road trip • Driving • Adventure • East Africa road trip • Namanga One Stop Border Post • East Africa Tourism • Africa travel vlog   🔎 HASHTAGS 🔎 #drivingineastafrica #arusha  #arushatanzania    #roadtrips  #adventure #roadtripping   #adventureinafrica #drivinginafrica #travelling  #travellingvlog   #travellingthroughafrica  #africavlog   #africaadventures   #africatravelvlog   #africaroadtrip #nairobikenya  #namangaborderpost #driving  #nairobi",[],14,22112025
10,rxeQiSezhyI,Driving from Andorra 🇦🇩 to Spain 🇪🇸 | Drive from the City of Andorra la Vella to the Town of Toses,5112023.0,UCcwGwvM5iPB9IvtTnMTVcEg,142576,"Jump into the driver's seat on this drive from the City of Andorra la Vella, in the country of Andorra, to the Town of Toses in Spain. Our drive starts in the the City of Andorra la Vella, which is the Capital city of Andorra. The country of Andorra is a mountainous microstate between France and Spain, and has population of approximately 79,000 people. On the way to Toses in Spain, we drive through the beautiful mountainous region of Catalonia in the foothills of the Pyrenees mountains. We arrive in the charming little town of Toses, Spain after a drive time of 1 Hour 34 Minutes 🛑Please Subscribe➤http://bit.ly/-STV  Sit Back, Relax, and Enjoy watching this FULL-length scenic road trip video in 4K quality. This Relaxing Video is best watched on a 4K big-screen TV with your legs stretched out on a big comfy couch. Optional, mute the video sound and play your favorite music along with the video.  ***** Route Info ***** ◎ Drive Date: October 2023 ◎ Start: City of Andorra la Vella, Andorra ◎ End: Toses, Spain ◎ Drive Distance from Andorra la Vella to Toses: 84 km / 52 mi ◎ Drive Time from Andorra la Vella to Toses: 1 Hour 34 Minutes ◎ Route: https://maps.app.goo.gl/Wk57GtM6sxPzCBvw8  ***** Places and Interesting points along the route ***** • 0:00 - City of Andorra la Vella (Capital city of Andorra), Andorra • 9:42 - Santa Coloma, Andorra • 14:18 - Sant Julià de Lòria, Andorra • 27:20 - Andorra-Spain border • 27:42 - Spain | España • 32:59 - La Seu d’Urgell, Spain • 52:47 - Martinet, Spain • 59:41 - Bellver de Cerdanya, Spain • 1:05:23 - Prats, Spain • 1:16:54 - La Molina, Spain • 1:33:47 - Toses, Spain  #Andorra #Spain #Pyrenees #RoadTrip #TravelVideo #ScenicView #ScenicDrive","[{'title': 'City of Andorra la Vella (Capital city of Andorra), Andorra', 'timestamp': '0:00:00'}, {'title': 'Santa Coloma, Andorra', 'timestamp': '0:09:42'}, {'title': 'Sant Julià de Lòria, Andorra', 'timestamp': '0:14:18'}, {'title': 'Andorra-Spain border', 'timestamp': '0:27:20'}, {'title': 'Spain | España', 'timestamp': '0:27:42'}, {'title': 'La Seu d’Urgell, Spain', 'timestamp': '0:32:59'}, {'title': 'Martinet, Spain', 'timestamp': '0:52:47'}, {'title': 'Bellver de Cerdanya, Spain', 'timestamp': '0:59:41'}, {'title': 'Prats, Spain', 'timestamp': '1:05:23'}, {'title': 'La Molina, Spain', 'timestamp': '1:16:54'}, {'title': 'Toses, Spain', 'timestamp': '1:33:47'}]",10,3062025
11,Iqg48tDqPEY,"Driving from Feldkirch, Austria to Liechtenstein",6112024.0,UC1EyY4iqdnCB1MIL5JVe6bg,2552,Video recorded on 2024 October,[],13,3062025
12,uZDBUddORzo,Driving in Liechtenstein (Road Trip to Cannes 2018),16062018.0,UCLybjxNRc6s3QXSmXOzTRxQ,20984,"This is part of our European Road Trip 2018 from the  UK to Cannes for a music conference called MIDEM.  Starting off from the ski-resort village of Malbun, and working my way down to Vaduz, through bits of Switzerland and Austria, though I had to pull over and take my dashcam off in Austria for obvious reasons.",[],12,3062025
13,ofIfvlKLb8k,Faroe Islands drive series ⑤ From Tórshavn to Klaksvík Faroe Islands 🇫🇴 October 2023,1072024.0,UCH1Mp77_k2IWQVs7BIdm_Fg,354,#travel #2023 #europe #greatview #denmark #faroeislands #driving #travellife #beautifuldestinations,[],8,3062025
14,sgu73NaHaDU,Eritrea-4K - Scenic Drive Keren To Asmara With Music 🇪🇷,30102024.0,UCVqqZf52GTU6DQLsTHgghfA,28595,Eritrea is one of Africa's hidden gems. Enjoy this 4k Scenic Relaxation film across Eritrea's diverse terrain. This is some of the epic landscapes and beautiful scenery you’ll see when you drive between the Keren and the Asmara… Where we call home. #ERITREA MUSIC #ERITREA CLASSIC MUSIC,[],9,3062025
